{"componentChunkName":"component---src-templates-work-js","path":"/work/cover","result":{"data":{"mdx":{"body":"function _extends() { _extends = Object.assign || function (target) { for (var i = 1; i < arguments.length; i++) { var source = arguments[i]; for (var key in source) { if (Object.prototype.hasOwnProperty.call(source, key)) { target[key] = source[key]; } } } return target; }; return _extends.apply(this, arguments); }\n\nfunction _objectWithoutProperties(source, excluded) { if (source == null) return {}; var target = _objectWithoutPropertiesLoose(source, excluded); var key, i; if (Object.getOwnPropertySymbols) { var sourceSymbolKeys = Object.getOwnPropertySymbols(source); for (i = 0; i < sourceSymbolKeys.length; i++) { key = sourceSymbolKeys[i]; if (excluded.indexOf(key) >= 0) continue; if (!Object.prototype.propertyIsEnumerable.call(source, key)) continue; target[key] = source[key]; } } return target; }\n\nfunction _objectWithoutPropertiesLoose(source, excluded) { if (source == null) return {}; var target = {}; var sourceKeys = Object.keys(source); var key, i; for (i = 0; i < sourceKeys.length; i++) { key = sourceKeys[i]; if (excluded.indexOf(key) >= 0) continue; target[key] = source[key]; } return target; }\n\n/* @jsxRuntime classic */\n\n/* @jsx mdx */\nvar _frontmatter = {\n  \"title\": \"Cover\",\n  \"tagline\": \"Split the check in seconds.\",\n  \"dek\": \"Cover was a tool that helped restaurant owners and diners focus on food - not the check. Our app split payments at the table, simplified tipping, and sent the transaction to the back of the house.\",\n  \"dateStart\": \"2015\",\n  \"dateEnd\": \"2015\",\n  \"roles\": [\"Senior product designer\"],\n  \"class\": \"cover\",\n  \"invertLine\": true,\n  \"keyImage\": \"images/work_key/cover.png\",\n  \"cardImage\": \"images/work_cards/cover.jpg\",\n  \"cardImagePosition\": \"52% 0\",\n  \"key\": 3\n};\n\nvar makeShortcode = function makeShortcode(name) {\n  return function MDXDefaultShortcode(props) {\n    console.warn(\"Component \" + name + \" was not imported, exported, or provided by MDXProvider as global scope\");\n    return mdx(\"div\", props);\n  };\n};\n\nvar Link = makeShortcode(\"Link\");\nvar ArticleMedia = makeShortcode(\"ArticleMedia\");\nvar Image = makeShortcode(\"Image\");\nvar Grid = makeShortcode(\"Grid\");\nvar layoutProps = {\n  _frontmatter: _frontmatter\n};\nvar MDXLayout = \"wrapper\";\nreturn function MDXContent(_ref) {\n  var components = _ref.components,\n      props = _objectWithoutProperties(_ref, [\"components\"]);\n\n  return mdx(MDXLayout, _extends({}, layoutProps, props, {\n    components: components,\n    mdxType: \"MDXLayout\"\n  }), mdx(\"p\", null, \"Cover was an iPhone and Android app for making dining out easier. At a restaurant that accepts Cover, diners can split the check, calculate the tip, and pay with Apple Pay or a credit card. Since there's no check at the end of the meal, they can leave without waiting for the server.\"), mdx(\"p\", null, \"Along with the diner-facing mobile app, Cover's restaurant-facing iPad app helped save servers' time by cutting down on card swipes. In a way, the product reminded me of what I enjoyed most during my time working with sellers at \", mdx(Link, {\n    to: \"/work/etsy\",\n    mdxType: \"Link\"\n  }, \"Etsy\"), \". We created positive products for people on both sides of a transaction.\"), mdx(\"p\", null, \"I joined Cover as their second designer in February, 2015. By April, we set out to rebrand the company and redesign its iPhone app and website, giving us the foundation to grow in a competitve mobile payments space.\"), mdx(\"h2\", {\n    \"id\": \"from-the-beginning\"\n  }, \"From the Beginning\"), mdx(ArticleMedia, {\n    caption: \"Checking into a restaurant in Cover 1.0\",\n    \"float\": \"true\",\n    mdxType: \"ArticleMedia\"\n  }, mdx(Image, {\n    src: \"images/work/cover/screenshot-old-landing-1-body.png\",\n    alt: \"Screenshot of checking into a restaurant in Cover 1.0\",\n    className: \"has-shadow\",\n    mdxType: \"Image\"\n  })), mdx(\"p\", null, \"When I arrived in February, Cover's iPhone app was a polished proof of concept. It focused on one function \\u2013 splitting the check and automating the tip after entering a restaurant. In later updates, this became even easier by allowing people to sign up with Facebook and split the check with friends who don't have Cover.\"), mdx(\"p\", null, \"But as we turned our attention to restaurant discovery features, Cover's handful of screens started to become cluttered. Without a navigation structure to compartmentalize different types of tasks, we were adding functionality to places the app wasn't designed for \\u2013 making what was a refreshingly simple payment flow more complicated.\"), mdx(\"p\", null, \"The Cover brand was also in need of an overhaul. Not only were we running out of space to add new information about restaurants, but that information was difficult to read due to the brand's dark color scheme and single display typeface. And as we would later discover, most apps in the food and dining space used knives and forks in their logos and app icons.\"), mdx(ArticleMedia, {\n    caption: \"Adding complexity over time to Cover 1.0\",\n    mdxType: \"ArticleMedia\"\n  }, mdx(Grid, {\n    tight: true,\n    mdxType: \"Grid\"\n  }, mdx(Image, {\n    src: \"images/work/cover/screenshot-old-browse-1-body.png\",\n    alt: \"Cover 1.0 screenshot\",\n    className: \"has-shadow\",\n    mdxType: \"Image\"\n  }), mdx(Image, {\n    src: \"images/work/cover/screenshot-old-browse-2-body.png\",\n    alt: \"Cover 1.0 screenshot\",\n    className: \"has-shadow\",\n    mdxType: \"Image\"\n  }))), mdx(\"p\", null, \"It's hard to justify starting from scratch. Valuable months that would otherwise be spent exploring new product ideas would instead be spent restructuring existing features. After a few struggles, it quickly became clear that having a scalable foundation for future product development would be necessary.\"), mdx(\"h3\", {\n    \"id\": \"the-team\"\n  }, \"The team\"), mdx(\"p\", null, \"I met our Frank and Kim, Cover's product and design leads, while working at Etsy. During our time there, we helped transform their engineering focused process into a more inclusive one that brought contributors together from across the company early and often in a product's development. Involving everyone \\u2013 even from outside of the product team \\u2013 meant goals were quickly defined, mistakes were caught earlier, and solutions were more creatively executed.\"), mdx(\"p\", null, \"Cover's team was dwarfed by Etsy's, but we scaled the same process down for our redesign. The engineers helped define the project's scope while sharing quantitative data from Cover 1.0. Cover's operations team \\u2013 a group of former industry experts turned points of contact \\u2013 also shared qualitative feedback from our restaurant partners.\"), mdx(\"p\", null, \"Aside from sitting near each other to facilite constant communication, our forum for cross-team brainstorming and feedback took place in brief, twice-weekly office hours. In some sessions we encouraged participation with Post-It exercises on industry research. Others were prototype presentations that led to complex engineering discussions. Documenting ideas and progress in Basecamp was another holdover from Etsy, giving us a second, more permanent avenue for feedback.\"), mdx(\"h2\", {\n    \"id\": \"kicking-off-cover-20\"\n  }, \"Kicking off Cover 2.0\"), mdx(\"p\", null, \"At the beginning of each project, our product team meets to define its goals. We do this by looking at the existing product, documenting its strengths and weaknesses, and coming to an agreement on what we're trying to accomplish. For Cover 2.0, we defined four key goals:\"), mdx(\"h3\", {\n    \"id\": \"1-build-a-foundation-for-the-future\"\n  }, \"1. Build a foundation for the future\"), mdx(\"p\", null, \"Cover 1.0 was limited by its single focus. We wanted to introduce a scalable navigation model that would allow us to add new features and improve old ones without making screens overly complex.\"), mdx(\"h3\", {\n    \"id\": \"2-provide-reasons-to-open-cover-before-a-meal\"\n  }, \"2. Provide reasons to open Cover before a meal\"), mdx(\"p\", null, \"More restaurants accept Cover than any of our competitors, and our team was regularly marketing new restaurants in emails and on social media. We wanted to bring this curated content into the app alongside better discovery tools.\"), mdx(\"h3\", {\n    \"id\": \"3-address-problems-with-check-splitting\"\n  }, \"3. Address problems with check splitting\"), mdx(\"p\", null, \"Splitting the check with Cover was already easy, but we knew there was room for improvement when sending and receiving invites. Helping people put their phones away more quickly would let them focus on what's important \\u2013 enjoying their company.\"), mdx(\"h3\", {\n    \"id\": \"4-clear-up-confusion-at-the-end-of-the-meal\"\n  }, \"4. Clear up confusion at the end of the meal\"), mdx(\"p\", null, \"One of Cover's long-term goals is to remove the need to open an app by completely automating the payment process. We had already done this at the end of the meal, but breaking habits is difficult \\u2013 people were afraid to leave the restaurant without confirmation from their server. We wanted to find a comfortable mix of instruction and simplicity throughout the experience.\"), mdx(\"p\", null, \"We intentionally left these goals vague. This process was designed to give everyone on the team an opportunity to define the project while still giving us the flexibility to explore different approaches as we iterate down the road.\"), mdx(\"h2\", {\n    \"id\": \"discovery\"\n  }, \"Discovery\"), mdx(\"p\", null, \"Cover is one of dozens of small companies working to gain a foothold in two crowded spaces. Mobile payments has matured with technologies from companies like Apple Pay and Square. The restaurant industry, on the other hand, is being flooded with apps for discovery, reservations, ticketing, waitlists, point-of-sale systems, customer loyalty, and payments.\"), mdx(ArticleMedia, {\n    caption: \"Mark Egerman, Co-founder\",\n    mdxType: \"ArticleMedia\"\n  }, mdx(\"blockquote\", null, \"There are a lot of people chasing this market and we're not all going to win.\")), mdx(\"p\", null, \"Each of Cover's competitors is taking a different approach. For most, the goal is the same \\u2013 an end-to-end system that lets diners rely on a single app for an experience that begins and ends outside of the restaurant. The unsettled industry makes standing out important, and dedicating time to understanding our competition was a valuable step of our design process.\"), mdx(\"p\", null, \"Kim and I spent a few days analyzing a number of apps, using printouts and Post-Its to gather our high-level takeaways. Since we would be refreshing our brand, we started by looking at app icons, color schemes, typography, and image treatments in apps serving the restaurant industry.\"), mdx(ArticleMedia, {\n    caption: \"Reviewing discovery takeaways with the product team\",\n    mdxType: \"ArticleMedia\"\n  }, mdx(Image, {\n    src: \"images/work/cover/war-room.jpg\",\n    alt: \"Photo of the Cover team discussing takeaways from our discovery phase\",\n    className: \"has-shadow\",\n    mdxType: \"Image\"\n  })), mdx(\"p\", null, \"Payments are sensitive, especially when making them through a new, unfamilar process. We also looked at how payment apps \\u2013 especially those whose brand hadn't already built ubiquitous trust \\u2013 reinforced security. Common motifs surfaced that implied a transaction is taking place, from colors and credit card logos to the way numbers were being presented on a receipt.\"), mdx(\"p\", null, \"We finished by looking at apps that helped people find restaurants, venues, and events. From talking to diners we already knew price and location were the most important factors when deciding on where to eat, so we catalogued how other apps were using this information across contexts like maps, lists, and detail screens. And since Cover is only available in New York, the Bay Area, and Los Angeles, we looked outside of Apple Maps to see how alternatives like Citymaps and Google Maps handled information density in busy urban areas.\"), mdx(\"h2\", {\n    \"id\": \"early-iteration\"\n  }, \"Early Iteration\"), mdx(\"p\", null, \"I start every project \\u2013 even those with quick timelines \\u2013 with black-and-white wireframes. Sometimes it's difficult to work at a low fidelity, but setting these limitations speeds up iteration in a phase where it's important to quickly cycle through ideas.\"), mdx(ArticleMedia, {\n    caption: \"Wireframing in Sketch\",\n    mdxType: \"ArticleMedia\"\n  }, mdx(Image, {\n    src: \"images/work/cover/sketch-wireframes-2.png\",\n    alt: \"Screenshot of Cover 2.0 wireframes\",\n    className: \"has-shadow\",\n    mdxType: \"Image\"\n  })), mdx(\"h3\", {\n    \"id\": \"curated-content\"\n  }, \"Curated content\"), mdx(\"p\", null, \"As our operations team grew and Cover gained more traction in our three cities, we were adding several new restaurants every week. We'd already been sending out twice-weekly emails to promote both new and existing restaurants, but this unique content was disappearing in peoples' inboxes.\"), mdx(ArticleMedia, {\n    caption: \"One of Cover's curated marketing emails\",\n    mdxType: \"ArticleMedia\"\n  }, mdx(Image, {\n    src: \"images/work/cover/email.jpg\",\n    alt: \"Screenshot of a Cover marketing email\",\n    className: \"has-shadow\",\n    mdxType: \"Image\"\n  })), mdx(ArticleMedia, {\n    caption: \"Featured restaurants in Cover 2.0\",\n    \"float\": \"true\",\n    mdxType: \"ArticleMedia\"\n  }, mdx(Image, {\n    src: \"images/work/cover/screenshot-featured.png\",\n    alt: \"Screenshot of a Cover 2.0's landing screen\",\n    className: \"has-shadow\",\n    mdxType: \"Image\"\n  })), mdx(\"p\", null, \"To make the most of this content, we designed a landing screen that would incorporate announcements and recommendations from our emails.\"), mdx(\"p\", null, \"By updating the app regularly with new restaurants and best-of lists, we gave people a reason to open Cover outside of restaurants. We even reserved space for help and promotional content since this would be the first screen people already logged in would see.\"), mdx(\"p\", null, \"We generated this webview from a simple YAML file so anyone on the team could push separate updates to New York, the Bay Area, and Los Angeles in minutes. To ensure the screen would feel like the rest of the app, I designed a simple CSS framework that would let us mirror native components.\"), mdx(\"h3\", {\n    \"id\": \"browsing-restaurants\"\n  }, \"Browsing restaurants\"), mdx(\"p\", null, \"Alongside our curated landing screen, we wanted to create a better way to sift through Cover's 300+ restaurants. Presenting a list of venues is something hundreds of apps have already done, but we found small ways to improve on the convention.\"), mdx(\"p\", null, \"On the list view, we grouped restaurants by neighborhood sorted by proximity. It's easy to understand distance when a restaurant is a few blocks away, but further could mean a restaurant is in much different areas of a city as dense as New York.\"), mdx(ArticleMedia, {\n    caption: \"Browsing restaurants in Cover 2.0\",\n    mdxType: \"ArticleMedia\"\n  }, mdx(Grid, {\n    tight: true,\n    mdxType: \"Grid\"\n  }, mdx(Image, {\n    src: \"images/work/cover/screenshot-dine-list.png\",\n    alt: \"Screenshot of a Cover 2.0's list view\",\n    className: \"has-shadow\",\n    mdxType: \"Image\"\n  }), mdx(Image, {\n    src: \"images/work/cover/screenshot-dine-map.png\",\n    alt: \"Screenshot of a Cover 2.0's map view\",\n    className: \"has-shadow\",\n    mdxType: \"Image\"\n  }))), mdx(\"p\", null, \"On the map view, we used restaurant logos, which are often wordmarks, as scannable pins. Since logos are larger than a standard map pin, we carefully engineered a way to maximize the number of logos visible without too much overlap.\"), mdx(\"p\", null, \"We also carefully chose to use Google Maps over Apple Maps or Mapbox. Apple's public transportation data was lacking at the time, so our specific audience would benefit from Google's subway information.\"), mdx(\"h2\", {\n    \"id\": \"research-and-validation\"\n  }, \"Research and validation\"), mdx(\"p\", null, \"Ideas are weightless until validated, regardless of how they sound in meetings or in mock-ups. Since Cover's app was changing in big ways, we ran almost 20 rounds of research staggered throughout the design process.\"), mdx(\"p\", null, \"Early in the project, we used Flinto \\u2013 a tool for creating static, clickable prototypes\"), mdx(ArticleMedia, {\n    caption: \"Sharing an early wireframe prototype on UserTesting.org\",\n    mdxType: \"ArticleMedia\"\n  }, mdx(Image, {\n    src: \"images/work/cover/user-testing-org.jpg\",\n    alt: \"Screenshot of sharing an early wireframe prototype on UserTesting.org\",\n    className: \"has-shadow\",\n    mdxType: \"Image\"\n  })), mdx(\"p\", null, \"Early prototypes gave us an opportunity to make sure the priorities we defined earlier in the project were accounted for and in the right place. It also gave us a way to share ideas outside of the product team in a way that was easier to understand.\"), mdx(ArticleMedia, {\n    caption: \"Joining a friend's table in Cover 1.0\",\n    \"float\": \"true\",\n    mdxType: \"ArticleMedia\"\n  }, mdx(Image, {\n    src: \"images/work/cover/screenshot-old-landing-2-body.png\",\n    alt: \"Screenshot of joining a friend's table in Cover 1.0\",\n    className: \"has-shadow\",\n    mdxType: \"Image\"\n  })), mdx(\"h3\", {\n    \"id\": \"checking-into-a-restaurant\"\n  }, \"Checking into a restaurant\"), mdx(\"p\", null, \"Most valuably, early prototypes helped us make decisions when addressing problems in Cover 1.0's payment process.\"), mdx(\"p\", null, \"When opening Cover 1.0 in a restaurant, diners would see a list of everyone checked in. This meant it was easy to join a friend to split the check, but this approach was unscalable \\u2013 especially if Cover were to expand to bars where dozens of diners could be checked in at once. Showing everyone's names and photos was also a common privacy concern.\"), mdx(\"p\", null, \"Our solution was one of the biggest engineering challenges of the redesign.\"), mdx(\"p\", null, \"We relied on bluetooth beacons placed near the entrance of each restaurant to determine if the diner was inside. If they were, Cover 2.0 would immediately suggest they check in.\"), mdx(\"p\", null, \"We also removed the list of checked in diners altogether. Instead, we relied on a combination of diners' address books and dining history to suggest joining a friend immediately after checking in. We affectionately referred to this prompt as the \\\"magic modal,\\\" and for most diners, this was the only action they needed to take.\"), mdx(ArticleMedia, {\n    caption: \"Checking into a restaurant in Cover 2.0\",\n    mdxType: \"ArticleMedia\"\n  }, mdx(Grid, {\n    tight: true,\n    mdxType: \"Grid\"\n  }, mdx(Image, {\n    src: \"images/work/cover/screenshot-dine-here-body.png\",\n    alt: \"Screenshot of a Cover 2.0's Dine Here screen\",\n    className: \"has-shadow\",\n    mdxType: \"Image\"\n  }), mdx(Image, {\n    src: \"images/work/cover/screenshot-magic-modal-body.png\",\n    alt: \"Screenshot of a Cover 2.0's 'magic modal\",\n    className: \"has-shadow\",\n    mdxType: \"Image\"\n  }))), mdx(\"p\", null, \"If a diner was too far from a bluetooth beacon or if they wanted to check into the restaurant before arriving, they could still do so from the restaurant's detail screen.\"), mdx(ArticleMedia, {\n    caption: \"Checking in from a restaurant's detail screen\",\n    \"float\": \"true\",\n    mdxType: \"ArticleMedia\"\n  }, mdx(Image, {\n    src: \"images/work/cover/screenshot-restaurant.png\",\n    alt: \"Screenshot of checking into a restaurant from its detail screen\",\n    className: \"has-shadow\",\n    mdxType: \"Image\"\n  })), mdx(\"p\", null, \"The only way for us to validate this new approach was to try it in one of our restaurants. Since Kim and I were regularly meeting with the team's engineers, they were able to create native prototypes before we dedicated time to polishing them. We started by sharing these prototypes internally, but eventually invited diners in restaurants \\u2013 most of whom hadn't heard of Cover \\u2013 to try them as well.\"), mdx(\"p\", null, \"Checking into a restaurant was confusing in early sessions. Labeling the action \\\"Pay at Charlie Bird\\\" implied the payment would be processed immediately. People were pressing the button at the end of the meal rather than at the beginning, which we addressed by adjusting the language to \\\"Check In at Charlie Bird\\\".\"), mdx(\"h3\", {\n    \"id\": \"using-cover-during-a-meal\"\n  }, \"Using Cover during a meal\"), mdx(\"p\", null, \"We also used these sessions to refine improvements to the in-meal screen for those needing to manually invite others or adjust their tip and payment information.\"), mdx(\"p\", null, \"Since Cover doesn't send a confirmation before the check is split, knowing who is checked in at a table is important. Cover 1.0's version of this screen hid that information behind a button. Inviting friends was also tedious \\u2013 especially for those with large address books \\u2013 because we didn't surface people nearby or friends from previous meals.\"), mdx(ArticleMedia, {\n    caption: \"Comparing Cover 1.0's and Cover 2.0's in-meal screens\",\n    mdxType: \"ArticleMedia\"\n  }, mdx(Grid, {\n    tight: true,\n    mdxType: \"Grid\"\n  }, mdx(Image, {\n    src: \"images/work/cover/screenshot-old-in-meal-body.png\",\n    alt: \"A screenshot of a Cover 1.0's in-meal screen\",\n    className: \"has-shadow\",\n    mdxType: \"Image\"\n  }), mdx(Image, {\n    src: \"images/work/cover/screenshot-in-meal-1-body.png\",\n    alt: \"A screenshot of an early version of Cover 2.0's in-meal screen\",\n    className: \"has-shadow\",\n    mdxType: \"Image\"\n  }))), mdx(\"p\", null, \"By dedicating more space to the diners checked in at a table, it became clearer who would be charged at the end of the meal. We also removed the receipt button that, when tapped on, frustrated diners with a \\\"coming soon\\\" note.\"), mdx(\"p\", null, \"What took the most iteration through research was the feature that makes Cover most valuable \\u2013 allowing people finished with their meal to leave without waiting for the check. Since we store diners' payment information on file, checking into a restaurant is all that needs to be done to apply a tip and process the payment. It's convenient, but leaving without interacting with the server can be uncomfortable.\"), mdx(ArticleMedia, {\n    caption: \"Giving diners more confidence by adding the Settle Up button\",\n    mdxType: \"ArticleMedia\"\n  }, mdx(Grid, {\n    tight: true,\n    mdxType: \"Grid\"\n  }, mdx(Image, {\n    src: \"images/work/cover/screenshot-in-meal-2-body.png\",\n    alt: \"A screenshot of Cover 2.0's settling up flow\",\n    className: \"has-shadow\",\n    mdxType: \"Image\"\n  }), mdx(Image, {\n    src: \"images/work/cover/screenshot-post-meal-body.png\",\n    alt: \"A screenshot of Cover 2.0's settling up flow\",\n    className: \"has-shadow\",\n    mdxType: \"Image\"\n  }))), mdx(\"p\", null, \"With Cover 1.0, diners were prompted to tell the server they were paying with Cover at the beginning of the meal. This caused some confusion \\u2013 diners expected to see their payment was confirmed at the end of the meal, oftenen lingering to avoid leaving without paying. In the same way we iterated on the check in action, we tried different ways of communicating Cover's flow through language and ultimately created an optional \\\"Settle Up\\\" button to tap at the end of the meal that gave diners the confidence they needed to leave the restaurant.\"), mdx(\"h2\", {\n    \"id\": \"polish\"\n  }, \"Polish\"), mdx(\"p\", null, \"When positive research sessions began to reinforce our changes to the app's structure and flow, we shifted focus to improving its presentation.\"), mdx(ArticleMedia, {\n    caption: \"From our video shoot at The Camlin for Cover's new website\",\n    mdxType: \"ArticleMedia\"\n  }, mdx(Image, {\n    src: \"images/work/cover/photo-shoot.jpg\",\n    alt: \"Photo from our video shoot for Cover's new website\",\n    className: \"has-shadow\",\n    mdxType: \"Image\"\n  })), mdx(\"h3\", {\n    \"id\": \"photos-and-video\"\n  }, \"Photos and video\"), mdx(\"p\", null, \"Our early discovery work led to a funny realization \\u2013 we and many of our competitors were using the same stock imagery in our apps, websites, and social media posts. Companies like Stocksy offer options that we were comfortable using, but we decided to organize shoots to gather photos and videos that both reflected our brand and featured two of our favorite restaurants.\"), mdx(\"p\", null, \"Cover 2.0 wasn't heavy on photography, but we found one opportunity to differentiate ourselves. New users would see our own unique photography during onboarding.\"), mdx(\"h3\", {\n    \"id\": \"colors-and-typefaces\"\n  }, \"Colors and typefaces\"), mdx(\"p\", null, \"We also tested new display typefaces in different contexts. Our choice would be used to identify each of Cover's hundreds of restaurants, so it was important to choose an option that was both unique and flexible.\"), mdx(ArticleMedia, {\n    caption: \"Testing display typefaces using restaurant names\",\n    mdxType: \"ArticleMedia\"\n  }, mdx(\"img\", {\n    src: \"/work/cover/typefaces.gif\",\n    alt: \"Gif showing different display typefaces for Cover's rebrand\",\n    className: \"has-shadow\"\n  })), mdx(\"p\", null, \"Color was also something we focused on late in the design process. Cover's old purple, while unique in a space dominated by red, was dark, muddy and made text difficult to read.\"), mdx(ArticleMedia, {\n    caption: \"Testing colors on key screens\",\n    mdxType: \"ArticleMedia\"\n  }, mdx(\"img\", {\n    src: \"/work/cover/colors.gif\",\n    alt: \"Gif showing different colors for Cover's rebrand\"\n  })), mdx(\"p\", null, \"After polishing some of the app's key screens, we created a template using Sketch's shared styles that let us quickly test different color and typography options.\"), mdx(\"h3\", {\n    \"id\": \"refining-animations-with-origami\"\n  }, \"Refining animations with Origami\"), mdx(\"p\", null, \"Transitioning to designing almost exclusively for iOS was tough. Since coding my first website almost 20 years ago, it's been important to have an understanding of how my work is engineered. While I've picked up a bit of Swift in my spare time, I'd found myself producing Sketch files at Cover \\u2013 less hands-on than the work I did on Etsy's CSS component library in 2014.\"), mdx(\"p\", null, \"I didn't contribute to engineering our app, but learning to create high fidelity prototypes in Origami gave me an outlet to bring designs to life with interactions and animations.\"), mdx(ArticleMedia, {\n    caption: \"One of several Origami workspaces used to prototype animations\",\n    mdxType: \"ArticleMedia\"\n  }, mdx(Image, {\n    src: \"images/work/cover/origami.png\",\n    alt: \"Screenshot of one of Cover 2.0's animation prototypes in Origami\",\n    className: \"has-shadow\",\n    mdxType: \"Image\"\n  })), mdx(\"p\", null, \"As design and engineering tools improve, thoughtful animations have become easier to implement. They can be eye candy at times, but when introducing new, unfamiliar workflows, nudging someone in the right direction with an animation can be a better learning tool than spelling instructions outright.\"), mdx(\"p\", null, \"For Cover 2.0, we used a combination of colors and animations to clarify whether a screen was related to before or after checking into a restaurant.\"), mdx(ArticleMedia, {\n    caption: \"Checking into a restaurant and viewing the in meal screen\",\n    mdxType: \"ArticleMedia\"\n  }, mdx(Grid, {\n    tight: true,\n    mdxType: \"Grid\"\n  }, mdx(\"video\", {\n    autoPlay: true,\n    muted: true,\n    loop: true,\n    className: \"has-shadow\"\n  }, mdx(\"source\", {\n    src: \"/work/cover/video-dine-here.mp4\",\n    type: \"video/mp4\"\n  })), mdx(\"video\", {\n    autoPlay: true,\n    muted: true,\n    loop: true,\n    className: \"has-shadow\"\n  }, mdx(\"source\", {\n    src: \"/work/cover/video-in-meal.mp4\",\n    type: \"video/mp4\"\n  })))), mdx(\"p\", null, \"By differentiating in-restaurant screens with more purple and by having them slide on top of out-of-restaurant screens, getting lost becomes less likely.\"), mdx(ArticleMedia, {\n    caption: \"Transitioning from the map to restaurant details\",\n    \"float\": \"true\",\n    mdxType: \"ArticleMedia\"\n  }, mdx(\"video\", {\n    autoPlay: true,\n    muted: true,\n    loop: true,\n    className: \"has-shadow\"\n  }, mdx(\"source\", {\n    src: \"/work/cover/video-map.mp4\",\n    type: \"video/mp4\"\n  }))), mdx(\"p\", null, \"We also improved transitioning from screen-to-screen on our map. Not only does the animation between these screens feel faster by keeping the map in place, but we draw attention to the green button by staggering its appearance.\"), mdx(\"p\", null, \"We were strapped for time, but Origami gave us the tools to refine details like these in hours rather than days. And while we didn't rely on Origami's code exporting, being able to give engineers working prototypes that use animation curves and values mirroring those in Xcode made their real implementation much easier.\"), mdx(\"h2\", {\n    \"id\": \"the-website\"\n  }, \"The website\"), mdx(\"p\", null, \"While the rest of the team completed work on Cover 2.0, I began redesigning our website. It would be a quick project in order to coincide with our launch, but we wanted to do more than reskin the old website with Cover's new branding.\"), mdx(\"p\", null, \"The existing website was long-neglected. Visually, it didn't reflect the updates Kim and I had made to Cover's brand in recent months. More importantly though, a lack of updates meant we weren't communicating some of Cover's most valuable characteristics \\u2013 our industry-leading number of restaurants, our unique features like SMS invites, and the experience of our team.\"), mdx(ArticleMedia, {\n    caption: \"Cover's new home page\",\n    mdxType: \"ArticleMedia\"\n  }, mdx(Image, {\n    src: \"images/work/cover/web-home.jpg\",\n    alt: \"Screenshot of Cover's new home page\",\n    className: \"has-shadow\",\n    mdxType: \"Image\"\n  })), mdx(\"p\", null, \"Alongside the new home page, I created additional pages that communicated our culture and history, offered downloadable brand assets, and spoke directly to prospective restaurants.\"), mdx(ArticleMedia, {\n    caption: \"Cover's new about page\",\n    mdxType: \"ArticleMedia\"\n  }, mdx(Image, {\n    src: \"images/work/cover/web-about-body.jpg\",\n    alt: \"Screenshot of Cover's new about page\",\n    className: \"has-shadow\",\n    mdxType: \"Image\"\n  })), mdx(\"p\", null, \"During my last year at Etsy, I lead an effort to replace aging CSS with a new library of modular components. Using similar methodology, I styled Cover's new website using flexible, object-oriented styles that we were able to use for both paywithcover.com and our app's web views.\"), mdx(ArticleMedia, {\n    caption: \"Modular CSS components\",\n    mdxType: \"ArticleMedia\"\n  }, mdx(Image, {\n    src: \"images/work/cover/css-partials.png\",\n    alt: \"Screenshot of Cover's modular CSS components\",\n    className: \"has-shadow\",\n    mdxType: \"Image\"\n  })), mdx(\"h2\", {\n    \"id\": \"thanks\"\n  }, \"Thanks\"), mdx(\"p\", null, \"Because we were such a small team, I'm proud of what we were able to accomplish in only a few months. Embracing ideas and feedback early in the design process from our operations team, diners, and restaurant partners helped us find and validate great solutions more quickly and effectively than we would have alone.\"), mdx(\"p\", null, \"Most importantly though, we created something for the right reasons \\u2013 to make great meals with friends and loved ones even better.\"), mdx(\"p\", null, \"Special thanks to our team who worked hard to make this all happen \\u2013 \", mdx(\"a\", _extends({\n    parentName: \"p\"\n  }, {\n    \"href\": \"https://twitter.com/kimbost\"\n  }), \"Kim Bost\"), \", \", mdx(\"a\", _extends({\n    parentName: \"p\"\n  }, {\n    \"href\": \"https://twitter.com/hirefrank\"\n  }), \"Frank Harris\"), \", \", mdx(\"a\", _extends({\n    parentName: \"p\"\n  }, {\n    \"href\": \"https://twitter.com/kiptastic\"\n  }), \"Christian Whitehouse\"), \", \", mdx(\"a\", _extends({\n    parentName: \"p\"\n  }, {\n    \"href\": \"https://twitter.com/eebfg\"\n  }), \"Chris Rotella\"), \", \", mdx(\"a\", _extends({\n    parentName: \"p\"\n  }, {\n    \"href\": \"https://twitter.com/jeffmanian\"\n  }), \"Jeff Manian\"), \", \", mdx(\"a\", _extends({\n    parentName: \"p\"\n  }, {\n    \"href\": \"https://twitter.com/superstrong\"\n  }), \"Robbie Mitchell\"), \", \", mdx(\"a\", _extends({\n    parentName: \"p\"\n  }, {\n    \"href\": \"https://twitter.com/ArielleShipper\"\n  }), \"Arielle Shipper\"), \", \", mdx(\"a\", _extends({\n    parentName: \"p\"\n  }, {\n    \"href\": \"https://twitter.com/sarah3o6\"\n  }), \"Sarah Arnold\"), \", \", mdx(\"a\", _extends({\n    parentName: \"p\"\n  }, {\n    \"href\": \"https://twitter.com/capocefalo\"\n  }), \"Michelle Capocefalo\"), \", and \", mdx(\"a\", _extends({\n    parentName: \"p\"\n  }, {\n    \"href\": \"https://twitter.com/PiuVino\"\n  }), \"Sarah O\\u2019Mealia\"), \".\"));\n}\n;\nMDXContent.isMDXComponent = true;","headings":[{"depth":2,"value":"From the Beginning"},{"depth":3,"value":"The team"},{"depth":2,"value":"Kicking off Cover 2.0"},{"depth":3,"value":"1. Build a foundation for the future"},{"depth":3,"value":"2. Provide reasons to open Cover before a meal"},{"depth":3,"value":"3. Address problems with check splitting"},{"depth":3,"value":"4. Clear up confusion at the end of the meal"},{"depth":2,"value":"Discovery"},{"depth":2,"value":"Early Iteration"},{"depth":3,"value":"Curated content"},{"depth":3,"value":"Browsing restaurants"},{"depth":2,"value":"Research and validation"},{"depth":3,"value":"Checking into a restaurant"},{"depth":3,"value":"Using Cover during a meal"},{"depth":2,"value":"Polish"},{"depth":3,"value":"Photos and video"},{"depth":3,"value":"Colors and typefaces"},{"depth":3,"value":"Refining animations with Origami"},{"depth":2,"value":"The website"},{"depth":2,"value":"Thanks"}],"frontmatter":{"title":"Cover","tagline":"Split the check in seconds.","dek":"Cover was a tool that helped restaurant owners and diners focus on food - not the check. Our app split payments at the table, simplified tipping, and sent the transaction to the back of the house.","dateStart":"2015","dateEnd":"2015","roles":["Senior product designer"],"class":"cover","invertLine":true,"keyImage":"images/work_key/cover.png"}}},"pageContext":{"slug":"/work/cover"}},"staticQueryHashes":["3808394817","3808394817","547143765","547143765","713810148","713810148"]}