{"componentChunkName":"component---src-templates-work-js","path":"/work/karma","result":{"data":{"mdx":{"body":"function _extends() { _extends = Object.assign || function (target) { for (var i = 1; i < arguments.length; i++) { var source = arguments[i]; for (var key in source) { if (Object.prototype.hasOwnProperty.call(source, key)) { target[key] = source[key]; } } } return target; }; return _extends.apply(this, arguments); }\n\nfunction _objectWithoutProperties(source, excluded) { if (source == null) return {}; var target = _objectWithoutPropertiesLoose(source, excluded); var key, i; if (Object.getOwnPropertySymbols) { var sourceSymbolKeys = Object.getOwnPropertySymbols(source); for (i = 0; i < sourceSymbolKeys.length; i++) { key = sourceSymbolKeys[i]; if (excluded.indexOf(key) >= 0) continue; if (!Object.prototype.propertyIsEnumerable.call(source, key)) continue; target[key] = source[key]; } } return target; }\n\nfunction _objectWithoutPropertiesLoose(source, excluded) { if (source == null) return {}; var target = {}; var sourceKeys = Object.keys(source); var key, i; for (i = 0; i < sourceKeys.length; i++) { key = sourceKeys[i]; if (excluded.indexOf(key) >= 0) continue; target[key] = source[key]; } return target; }\n\n/* @jsxRuntime classic */\n\n/* @jsx mdx */\nvar _frontmatter = {\n  \"title\": \"Karma\",\n  \"tagline\": \"Wifi worth sharing.\",\n  \"dek\": \"Karmaâ€™s goal was to deliver simpler, friendlier internet to everyone. Our small team branded the device, designed its marketing, and built both web and app-based tools to manage your data.\",\n  \"dateStart\": \"2016\",\n  \"dateEnd\": \"2016\",\n  \"roles\": [\"Senior product designer\"],\n  \"className\": \"karma\",\n  \"invertColors\": true,\n  \"keyImage\": \"images/work_key/karma.png\",\n  \"cardImage\": \"images/work_cards/karma.jpg\",\n  \"cardImagePosition\": \"50% 0\",\n  \"key\": 2\n};\n\nvar makeShortcode = function makeShortcode(name) {\n  return function MDXDefaultShortcode(props) {\n    console.warn(\"Component \" + name + \" was not imported, exported, or provided by MDXProvider as global scope\");\n    return mdx(\"div\", props);\n  };\n};\n\nvar ArticleMedia = makeShortcode(\"ArticleMedia\");\nvar Image = makeShortcode(\"Image\");\nvar Grid = makeShortcode(\"Grid\");\nvar Link = makeShortcode(\"Link\");\nvar Tweet = makeShortcode(\"Tweet\");\nvar layoutProps = {\n  _frontmatter: _frontmatter\n};\nvar MDXLayout = \"wrapper\";\nreturn function MDXContent(_ref) {\n  var components = _ref.components,\n      props = _objectWithoutProperties(_ref, [\"components\"]);\n\n  return mdx(MDXLayout, _extends({}, layoutProps, props, {\n    components: components,\n    mdxType: \"MDXLayout\"\n  }), mdx(\"p\", null, \"My first experience relying on a WiFi hotspot was during a trip to Tokyo in 2015. I'd previously relied on Verizon and AT&T's international travel plans, but they were prohibitively expensive, had uncomfortable data caps, and lived on confusing account pages. Renting an affordable LTE hotspot with unlimited data was liberating, letting me focus on my trip rather than rationing data and draining my phone's battery.\"), mdx(\"p\", null, \"Our lagging cellular infrastructure means we're years away from having similar products stateside, but one company had been on my radar for taking a different approach than Verizon and AT&T. Karma had two easy-to-understand plans headlined by pay-as-you-go data that never expired. And fitting with companies like Nest, Casper, or Harry's who have elevated products that historically suffered from poor design, Karma's beautiful hotspot stood out.\"), mdx(\"p\", null, \"In early 2016, I joined Karma as their second product designer with the goal of making Internet access affordable and accessible.\"), mdx(ArticleMedia, {\n    caption: \"Karma Go\",\n    mdxType: \"ArticleMedia\"\n  }, mdx(Image, {\n    src: \"images/work/karma/karma-go.jpg\",\n    alt: \"Photo of Karma Go\",\n    mdxType: \"Image\"\n  })), mdx(\"h2\", {\n    \"id\": \"goodbye-neverstop\"\n  }, \"Goodbye, Neverstop\"), mdx(\"p\", null, \"The day I arrived at Karma, we were in the process of discontinuing our monthly subscription service called Neverstop. Karma is a mobile virtual network operator (MVNO) \\u2013 a type of data provider that doesn't own its network. Instead, we rely on data purchased wholesale from Sprint. We loved Neverstop's simplicity \\u2013 $50 for contract-free, unlimited Internet access \\u2013 but customers' unexpectedly heavy data usage outweighed what we could afford. The plan was unsustainable.\"), mdx(ArticleMedia, {\n    caption: \"The Verge reporting on Neverstop's cancellation\",\n    mdxType: \"ArticleMedia\"\n  }, mdx(Image, {\n    src: \"images/work/karma/the-verge.jpg\",\n    alt: \"Screenshot of The Verge reporting on Neverstop's cancellation\",\n    className: \"has-shadow\",\n    mdxType: \"Image\"\n  })), mdx(\"p\", null, \"My job was to work on Neverstop's replacement \\u2013 a capped, monthly subscription service we named Pulse. The new plan would be less appealing than Neverstop and we expected people to switch to our pay-as-you-go option, but we wanted to avoid disrupting service for our subscribers. Because we were losing money each day Neverstop remained online, it was important to work quickly.\"), mdx(\"p\", null, \"Unlike Neverstop's one-price-fits-all model, Pulse would have three tiers with varying amounts of expiring, monthly data. This meant our native apps and website required more than replacing the name and pricing. We would need to update nearly the entirety of our native apps and website, including our storefronts, account pages, and usage screens.\"), mdx(ArticleMedia, {\n    caption: \"Our updated store (left) and switching Pulse tiers (right)\",\n    mdxType: \"ArticleMedia\"\n  }, mdx(Grid, {\n    tight: true,\n    mdxType: \"Grid\"\n  }, mdx(Image, {\n    src: \"images/work/karma/screenshot-store-body-1.png\",\n    alt: \"Screenshot of the Karma app's updated store\",\n    className: \"has-shadow\",\n    mdxType: \"Image\"\n  }), mdx(Image, {\n    src: \"images/work/karma/screenshot-store-body-2.png\",\n    alt: \"Screenshot of switching Pulse tiers in the Karma app\",\n    className: \"has-shadow\",\n    mdxType: \"Image\"\n  }))), mdx(\"p\", null, \"Since there were more options available, subscribers' account screens needed to be updated. We also needed to design states for subscribers running out of data, giving them options to purchase more to avoid being stuck offline.\"), mdx(ArticleMedia, {\n    caption: \"Our updated billing screen (left) and an example out-of-data state (right)\",\n    mdxType: \"ArticleMedia\"\n  }, mdx(Grid, {\n    tight: true,\n    mdxType: \"Grid\"\n  }, mdx(Image, {\n    src: \"images/work/karma/screenshot-account-body-1.png\",\n    alt: \"Screenshot of the Karma app's updated billing screen\",\n    className: \"has-shadow\",\n    mdxType: \"Image\"\n  }), mdx(Image, {\n    src: \"images/work/karma/screenshot-account-body-2.png\",\n    alt: \"Screenshot the Karma app's out-of-data state\",\n    className: \"has-shadow\",\n    mdxType: \"Image\"\n  }))), mdx(\"p\", null, \"With new caps, we had to better communicate subscribers' remaining data for their billing period. Since this was more complex than the other screens, I began by wireframing as many rough ideas as possible \\u2013 giving the team starting points to base discussion and decision making on.\"), mdx(ArticleMedia, {\n    caption: \"Usage screen wireframes\",\n    mdxType: \"ArticleMedia\"\n  }, mdx(Image, {\n    src: \"images/work/karma/app-usage-wireframes.jpg\",\n    alt: \"Wireframes of Karma's data usage screen\",\n    className: \"has-shadow\",\n    mdxType: \"Image\"\n  })), mdx(\"p\", null, \"We decided on a direction that resembled the existing usage screen that now highlighted daily, monthly, and yearly usage alongside the subscriber's plan and its renewal date.\"), mdx(ArticleMedia, {\n    caption: \"Our updated usage screen\",\n    mdxType: \"ArticleMedia\"\n  }, mdx(Grid, {\n    tight: true,\n    mdxType: \"Grid\"\n  }, mdx(Image, {\n    src: \"images/work/karma/screenshot-usage-body-1.png\",\n    alt: \"Screenshot of the Karma app's usage screen\",\n    className: \"has-shadow\",\n    mdxType: \"Image\"\n  }), mdx(Image, {\n    src: \"images/work/karma/screenshot-usage-body-2.png\",\n    alt: \"Screenshot the Karma app's usage screen\",\n    className: \"has-shadow\",\n    mdxType: \"Image\"\n  }))), mdx(\"p\", null, \"Since we were making adjustments throughout the app, \", mdx(Link, {\n    to: \"https://twitter.com/alandickinson\",\n    mdxType: \"Link\"\n  }, \"Alan\"), \" and I took the opportunity to clean up design inconsistencies. \", mdx(Link, {\n    to: \"https://zeplin.io/\",\n    mdxType: \"Link\"\n  }, \"Zeplin\"), \" became useful for sharing these changes with our engineers, giving them an easier way to calculate iOS and Android units on our new grid, reduce the number of type styles, and fix mislabeled colors.\"), mdx(ArticleMedia, {\n    caption: \"App mockups organized in Zeplin\",\n    mdxType: \"ArticleMedia\"\n  }, mdx(Image, {\n    src: \"images/work/karma/zeplin.jpg\",\n    alt: \"Screenshot of Karma's app mockups in organized in Zeplin\",\n    className: \"has-shadow\",\n    mdxType: \"Image\"\n  })), mdx(\"p\", null, \"We try to maintain feature parity between our apps and the web, so we designed a simplified web dashboard to more easily manage Pulse subscriptions. Our redesign consolidated the existing web dashboard from five pages to one, while still surfacing once-hidden usage details.\"), mdx(ArticleMedia, {\n    caption: \"My signed in dashboard with expanded usage graphs\",\n    mdxType: \"ArticleMedia\"\n  }, mdx(Image, {\n    src: \"images/work/karma/web-dashboard.jpg\",\n    alt: \"Screenshot of Karma's in-browser usage dashboard\",\n    className: \"has-shadow\",\n    mdxType: \"Image\"\n  })), mdx(\"p\", null, \"A gigabyte is abstract. For most subscribers who relied on Karma Go for email and web browsing, their experience wouldn't change. To talk about the new data caps in a way that was more understandable, we created a series of blog and social media posts explaining what really goes into a gigabyte.\"), mdx(ArticleMedia, {\n    caption: \"Data usage animations\",\n    mdxType: \"ArticleMedia\"\n  }, mdx(Grid, {\n    tight: true,\n    mdxType: \"Grid\"\n  }, mdx(\"img\", {\n    src: \"/work/karma/15000-email.gif\",\n    alt: \"Karma data usage animation\"\n  }), mdx(\"img\", {\n    src: \"/work/karma/5000-maps.gif\",\n    alt: \"Karma data usage animation\"\n  })), mdx(Grid, {\n    tight: true,\n    mdxType: \"Grid\"\n  }, mdx(\"img\", {\n    src: \"/work/karma/500-gifs.gif\",\n    alt: \"Karma data usage animation\"\n  }), mdx(\"img\", {\n    src: \"/work/karma/15-albums.gif\",\n    alt: \"Karma data usage animation\"\n  }))), mdx(\"h2\", {\n    \"id\": \"revamping-the-website\"\n  }, \"Revamping the website\"), mdx(\"p\", null, \"Even with the disappointment surrounding Neverstop, we were happy with Pulse's launch. But our worry-free, unlimited data plan that had differentiated us was now as worry-inducing as capped plans from AT&T, Verizon, and others. Our customer's excitement from Neverstop's launch in September had been replaced by frustration on social media, Karma Go returns and subscription cancellations.\"), mdx(\"p\", null, \"We believed we still had a great product, so we chose to update our website to better emphasize it.\"), mdx(\"h3\", {\n    \"id\": \"leading-with-sharing\"\n  }, \"Leading with sharing\"), mdx(\"p\", null, \"Karma's differentiator is its sharing model. Because of its open SSID, anyone can connect to a Karma Go and get online with their own data. The owner is rewarded with free data of their own, making them feel good about getting others online in the process. Every day, we would receive emails from excited customers who had earned hundreds of megabytes by leaving their Karma Go on at airports or festivals.\"), mdx(Tweet, {\n    tweetLink: \"https://twitter.com/Werner/status/721821758773456896\",\n    align: \"center\",\n    mdxType: \"Tweet\"\n  }), mdx(\"p\", null, \"Our homepage hadn't been updated in several months. Since its launch, Neverstop came and was replaced by Pulse \\u2013 a different model than the strictly pay-as-you-go language we led with.\"), mdx(\"p\", null, \"We needed to show our two data options alongside clearer shots of Karma Go and more visible app download links. Most visibly though, we also decided to dedicate space to feeling good by sharing.\"), mdx(ArticleMedia, {\n    caption: \"Homepage wireframes\",\n    mdxType: \"ArticleMedia\"\n  }, mdx(Image, {\n    src: \"images/work/karma/web-home-wireframes.jpg\",\n    alt: \"Wireframes of Karma's new homepage\",\n    className: \"has-shadow\",\n    mdxType: \"Image\"\n  })), mdx(\"p\", null, \"After deciding on a direction, we spent time shooting photos and creating new Karma Go renders for our launch a week later.\"), mdx(ArticleMedia, {\n    caption: \"Karma's new homepage\",\n    mdxType: \"ArticleMedia\"\n  }, mdx(Image, {\n    src: \"images/work/karma/web-home.jpg\",\n    alt: \"Screenshot of Karma's new homepage\",\n    className: \"has-shadow\",\n    mdxType: \"Image\"\n  })), mdx(\"h3\", {\n    \"id\": \"showcasing-karma-go\"\n  }, \"Showcasing Karma Go\"), mdx(\"p\", null, \"Compared to other hotspots wrapped in cheap plastic and carrier logos, Karma Go looked great next to a Macbook and a cup of coffee. Our customers loved sharing photos of theirs on Twitter and Instagram, and it was frequently featured in fashion-forward buyer guides. But despite how much attention we put into Karma Go's design, we never designed a product page to showcase it in detail.\"), mdx(\"p\", null, \"To show how Karma Go could fit into your lifestyle, I spent a few days photographing it alongside objects it might appear with \\u2013 notebooks and MetroCards for people using Karma Go at work, and trail maps and passports for those on the go.\"), mdx(ArticleMedia, {\n    caption: \"Karma Go's product page\",\n    mdxType: \"ArticleMedia\"\n  }, mdx(Image, {\n    src: \"images/work/karma/web-karma-go.jpg\",\n    alt: \"Screenshot of Karma Go's new product page\",\n    className: \"has-shadow\",\n    mdxType: \"Image\"\n  })), mdx(\"h3\", {\n    \"id\": \"explaining-our-plans\"\n  }, \"Explaining our plans\"), mdx(\"p\", null, \"Finally, we needed to update our pricing page to explain the new differences between Refuel (our pay-as-you-go option) and Pulse. Our idea was to design a page for each \\u2013 giving us the opportunity to go into detail on benefits, use cases, and customer feedback specific to both plans.\"), mdx(ArticleMedia, {\n    caption: \"Our first attempt at a set of pricing pages for Refuel and Pulse\",\n    mdxType: \"ArticleMedia\"\n  }, mdx(Image, {\n    src: \"images/work/karma/web-pricing-1.jpg\",\n    alt: \"Screenshot of a first attempt at new pricing pages for Refuel and Pulse\",\n    className: \"has-shadow\",\n    mdxType: \"Image\"\n  })), mdx(\"p\", null, \"Splitting pricing across two pages was confusing in practice. Emotional use cases can be effective, but we relied too heavily on them at the expense of making our plans understandable. People wanted to see features laid out side-by-side \\u2013 giving them the chance to make their own decision on which plan worked for them.\"), mdx(ArticleMedia, {\n    caption: \"The second, simpler version of our pricing page\",\n    mdxType: \"ArticleMedia\"\n  }, mdx(Image, {\n    src: \"images/work/karma/web-pricing-2.jpg\",\n    alt: \"Screenshot of the second version of pricing pages for Refuel and Pulse\",\n    className: \"has-shadow\",\n    mdxType: \"Image\"\n  })), mdx(\"h3\", {\n    \"id\": \"premium-features\"\n  }, \"Premium features\"), mdx(\"p\", null, \"In July, we released Premium Features \\u2013 an optional set of add-ons for our customers. The set of Premium Features would expand over time, but our set of launch features was sparse. Securing Karma Go's SSID would allow for several frequently requested functions though, so we designed a page to explain what subscribing meant for how a customer could use their Karma Go.\"), mdx(ArticleMedia, {\n    caption: \"Premium Features\",\n    mdxType: \"ArticleMedia\"\n  }, mdx(Image, {\n    src: \"images/work/karma/web-premium-features.jpg\",\n    alt: \"Screenshot of the Premium Features page\",\n    className: \"has-shadow\",\n    mdxType: \"Image\"\n  })), mdx(\"h2\", {\n    \"id\": \"thanks\"\n  }, \"Thanks\"), mdx(\"p\", null, \" Startups are hard. In the end, Karma's investors installed a telecom industry CEO and transformed the company into everything we were working against. Karma Go was replaced with cheap hardware powered by off-the-shelf software. But like my work at \", mdx(Link, {\n    to: \"/etsy\",\n    mdxType: \"Link\"\n  }, \"Etsy\"), \" and \", mdx(Link, {\n    to: \"/cover\",\n    mdxType: \"Link\"\n  }, \"Cover\"), \", I'm happy to say we created something for the right reasons \\u2013 working towards a future of affordable and accessible Internet for everyone.\"), mdx(\"p\", null, \" Special thanks to those I worked most closely with \\u2013 \", mdx(\"a\", _extends({\n    parentName: \"p\"\n  }, {\n    \"href\": \"https://twitter.com/alandickinson\"\n  }), \"Alan Dickinson\"), \", \", mdx(\"a\", _extends({\n    parentName: \"p\"\n  }, {\n    \"href\": \"https://twitter.com/AndrewSowers\"\n  }), \"Andrew Sowers\"), \", \", mdx(\"a\", _extends({\n    parentName: \"p\"\n  }, {\n    \"href\": \"https://twitter.com/ankur_vashi\"\n  }), \"Ankur Vashi\"), \", \", mdx(\"a\", _extends({\n    parentName: \"p\"\n  }, {\n    \"href\": \"https://twitter.com/daveofthefuture\"\n  }), \"Dave Ford\"), \", \", mdx(\"a\", _extends({\n    parentName: \"p\"\n  }, {\n    \"href\": \"https://twitter.com/dkln\"\n  }), \"Diederick Lawson\"), \", \", mdx(\"a\", _extends({\n    parentName: \"p\"\n  }, {\n    \"href\": \"https://twitter.com/JessieGoldberg\"\n  }), \"Jessie Goldberg\"), \", \", mdx(\"a\", _extends({\n    parentName: \"p\"\n  }, {\n    \"href\": \"https://twitter.com/JessieGoldberg\"\n  }), \"Paul Bakker\"), \", \", mdx(\"a\", _extends({\n    parentName: \"p\"\n  }, {\n    \"href\": \"https://twitter.com/petersunna\"\n  }), \"Peter Sunna\"), \", \", mdx(\"a\", _extends({\n    parentName: \"p\"\n  }, {\n    \"href\": \"https://twitter.com/sheridanvk\"\n  }), \"Sheridan Kates\"), \", Sjoerd Smit, \", mdx(\"a\", _extends({\n    parentName: \"p\"\n  }, {\n    \"href\": \"https://twitter.com/sborsje\"\n  }), \"Stefan Borsje\"), \", and \", mdx(\"a\", _extends({\n    parentName: \"p\"\n  }, {\n    \"href\": \"https://twitter.com/stevenvanwel\"\n  }), \"Stevan van Wel\"), \". \"));\n}\n;\nMDXContent.isMDXComponent = true;","headings":[{"depth":2,"value":"Goodbye, Neverstop"},{"depth":2,"value":"Revamping the website"},{"depth":3,"value":"Leading with sharing"},{"depth":3,"value":"Showcasing Karma Go"},{"depth":3,"value":"Explaining our plans"},{"depth":3,"value":"Premium features"},{"depth":2,"value":"Thanks"}],"frontmatter":{"title":"Karma","tagline":"Wifi worth sharing.","dek":"Karmaâ€™s goal was to deliver simpler, friendlier internet to everyone. Our small team branded the device, designed its marketing, and built both web and app-based tools to manage your data.","dateStart":"2016","dateEnd":"2016","roles":["Senior product designer"],"className":"karma","invertColors":true,"keyImage":"images/work_key/karma.png"}}},"pageContext":{"slug":"/work/karma"}},"staticQueryHashes":["3808394817","3808394817","547143765","547143765","713810148","713810148"]}