{"componentChunkName":"component---src-templates-work-js","path":"/work/etsy","result":{"data":{"mdx":{"body":"function _extends() { _extends = Object.assign || function (target) { for (var i = 1; i < arguments.length; i++) { var source = arguments[i]; for (var key in source) { if (Object.prototype.hasOwnProperty.call(source, key)) { target[key] = source[key]; } } } return target; }; return _extends.apply(this, arguments); }\n\nfunction _objectWithoutProperties(source, excluded) { if (source == null) return {}; var target = _objectWithoutPropertiesLoose(source, excluded); var key, i; if (Object.getOwnPropertySymbols) { var sourceSymbolKeys = Object.getOwnPropertySymbols(source); for (i = 0; i < sourceSymbolKeys.length; i++) { key = sourceSymbolKeys[i]; if (excluded.indexOf(key) >= 0) continue; if (!Object.prototype.propertyIsEnumerable.call(source, key)) continue; target[key] = source[key]; } } return target; }\n\nfunction _objectWithoutPropertiesLoose(source, excluded) { if (source == null) return {}; var target = {}; var sourceKeys = Object.keys(source); var key, i; for (i = 0; i < sourceKeys.length; i++) { key = sourceKeys[i]; if (excluded.indexOf(key) >= 0) continue; target[key] = source[key]; } return target; }\n\n/* @jsxRuntime classic */\n\n/* @jsx mdx */\nvar _frontmatter = {\n  \"title\": \"Etsy\",\n  \"tagline\": \"People power.\",\n  \"dek\": \"You know Etsy. I led design on an effort to make seller tools more cohesive while introducing a company-wide component-based design system.\",\n  \"dateStart\": \"2013\",\n  \"dateEnd\": \"2015\",\n  \"roles\": [\"Staff product designer\"],\n  \"class\": \"etsy\",\n  \"invertLine\": true,\n  \"keyImage\": \"images/work_key/etsy.png\",\n  \"cardImage\": \"images/work_cards/etsy.jpg\",\n  \"cardImagePosition\": \"50% 0\",\n  \"key\": 4\n};\n\nvar makeShortcode = function makeShortcode(name) {\n  return function MDXDefaultShortcode(props) {\n    console.warn(\"Component \" + name + \" was not imported, exported, or provided by MDXProvider as global scope\");\n    return mdx(\"div\", props);\n  };\n};\n\nvar ArticleMedia = makeShortcode(\"ArticleMedia\");\nvar Image = makeShortcode(\"Image\");\nvar layoutProps = {\n  _frontmatter: _frontmatter\n};\nvar MDXLayout = \"wrapper\";\nreturn function MDXContent(_ref) {\n  var components = _ref.components,\n      props = _objectWithoutProperties(_ref, [\"components\"]);\n\n  return mdx(MDXLayout, _extends({}, layoutProps, props, {\n    components: components,\n    mdxType: \"MDXLayout\"\n  }), mdx(\"p\", null, \"Before joining Cover in 2015, I was a member of Etsy's product design team. It was a transformative time for the company as we assembled a new team of researchers and tripled the number of product designers. This led to more collaborative product development in contrast to the loose, engineering-first process that preceeded my time there.\"), mdx(\"p\", null, \"While my role as Staff Product Designer meant I spent time mentoring younger designers and helping intiate some of these changes, I also led design on several projects.\"), mdx(\"h2\", {\n    \"id\": \"seller-onboarding\"\n  }, \"Seller Onboarding\"), mdx(\"p\", null, \"Etsy's tools for its sellers were powerful, but getting started was complicated. Forms and customization options were presented with little explanation. The process was also nonlinear, so it was unclear where to start. We simplified onboarding by reducing the number of steps and offering contextual suggestions when appropriate.\"), mdx(ArticleMedia, {\n    caption: \"Entering billing information during seller onboarding\",\n    mdxType: \"ArticleMedia\"\n  }, mdx(Image, {\n    src: \"images/work/etsy/linear-onboarding.jpg\",\n    alt: \"Screenshot of entering billing information during seller onboarding\",\n    className: \"has-shadow\",\n    mdxType: \"Image\"\n  })), mdx(\"h2\", {\n    \"id\": \"product-announcements\"\n  }, \"Product announcements\"), mdx(\"p\", null, \"Sellers are understandably sensitive about how their listings appear across Etsy's different platforms. After launching a year-long redesign of the listing page on Etsy.com, we were sure to carefully communicate what had changed. Alongside blog and forums posts, we designed a page that visualized what was new.\"), mdx(ArticleMedia, {\n    caption: \"Introducing Etsy's new listing page\",\n    mdxType: \"ArticleMedia\"\n  }, mdx(Image, {\n    src: \"images/work/etsy/new-listing-page.jpg\",\n    alt: \"Screenshot of Etsy's new listing page announcement\",\n    className: \"has-shadow\",\n    mdxType: \"Image\"\n  })), mdx(\"h2\", {\n    \"id\": \"introducing-manufacturing\"\n  }, \"Introducing manufacturing\"), mdx(\"p\", null, \"For most of its history, Etsy strictly limited its marketplace to handmade items. Over time though, its most successful sellers found themselves hindered by that policy. To meet their shops' demand, many of these sellers were \\\"graduating\\\" from Etsy \\u2013 being forced to leave for other platforms with looser guidelines on hiring employees.\"), mdx(\"p\", null, \"We knew changing handmade policies would risk agitating the community, but these departures were becoming a problem. Our solution was an application process to ensure sellers were working with responsible manufacturing partners.\"), mdx(ArticleMedia, {\n    caption: \"Applying to sell with a manufacturing partner\",\n    mdxType: \"ArticleMedia\"\n  }, mdx(Image, {\n    src: \"images/work/etsy/manufacturing-form.jpg\",\n    alt: \"Screenshot of Etsy's manufacturing partner application form\",\n    className: \"has-shadow\",\n    mdxType: \"Image\"\n  })), mdx(\"p\", null, \"Along with Etsy's new policies, we answered questions during a streaming town hall session and created a page explaining the changes.\"), mdx(ArticleMedia, {\n    caption: \"Introducing manufacturing guidelines\",\n    mdxType: \"ArticleMedia\"\n  }, mdx(Image, {\n    src: \"images/work/etsy/manufacturing.jpg\",\n    alt: \"Screenshot of Etsy's manufacturing guidelines page\",\n    className: \"has-shadow\",\n    mdxType: \"Image\"\n  })), mdx(\"h2\", {\n    \"id\": \"better-tools-for-sellers\"\n  }, \"Better tools for sellers\"), mdx(\"p\", null, \"I began my second year at Etsy by joining the Shop Management team \\u2013 a group dedicated to improving tools for sellers. By visiting sellers' studios during the busy holiday season, we noted shortcomings in the product and the workarounds sellers developed to solve for them.\"), mdx(ArticleMedia, {\n    caption: \"Helping ship orders at ElloThere's Brooklyn studio\",\n    mdxType: \"ArticleMedia\"\n  }, mdx(Image, {\n    src: \"images/work/etsy/studio-visit.jpg\",\n    alt: \"Photo of Aaron helping ship orders at a seller's studio\",\n    className: \"has-shadow\",\n    mdxType: \"Image\"\n  })), mdx(\"h3\", {\n    \"id\": \"shipping-profiles\"\n  }, \"Shipping profiles\"), mdx(\"p\", null, \"The most painful problems revolved around accepting and fulfilling orders. Our first project was a simple tool for shipping profiles \\u2013 a way to apply and edit your listings' shipping information in bulk.\"), mdx(ArticleMedia, {\n    caption: \"Adding shipping profiles to Etsy's listings manager\",\n    mdxType: \"ArticleMedia\"\n  }, mdx(Image, {\n    src: \"images/work/etsy/old-listings.jpg\",\n    alt: \"Screenshot of shipping profiles in Etsy's old listings manager\",\n    className: \"has-shadow\",\n    mdxType: \"Image\"\n  })), mdx(\"p\", null, \"Sellers liked the new feature, but we uncovered a problem while discussing what to tackle next. Years of adding new tools rather than strengthening existing ones had led to a disjointed experience. Core workflows like organizing inventory, fulfilling orders, and communicating with buyers were spread across several pages. During some of our studio visits, sellers were even placing browser windows side-by-side to accomplish one task.\"), mdx(\"p\", null, \"After lengthy conversations with other team leads, we decided to address the problem by dedicating the following year to redesigning the suite of seller tools. During those conversations, we defined three key goals:\"), mdx(\"h3\", {\n    \"id\": \"1-think-of-pages-as-workflows-rather-than-features\"\n  }, \"1. Think of pages as workflows rather than features\"), mdx(\"p\", null, \"After documenting each feature scattered across dozens of pages, we grouped them into core workflows \\u2013 inventory management, order fulfillment, billing, promotion, statistics, and settings. Each workflow would be represented by a single page.\"), mdx(\"h3\", {\n    \"id\": \"2-design-for-every-screen-size\"\n  }, \"2. Design for every screen size\"), mdx(\"p\", null, \"Etsy.com's base layout was a static 980 pixels wide, but we knew sellers were using large screens in their studios and their phones on the go. Since we would be redesigning the entire suite of tools at once, we were comfortable creating a responsive layout that would work everywhere.\"), mdx(\"h3\", {\n    \"id\": \"3-save-sellers-time-with-faster-tools\"\n  }, \"3. Save sellers' time with faster tools\"), mdx(\"p\", null, \"Similarly, the team's engineers saw the redesign as an opportunity to experiment with creating single page web application. This would speed up small changes like price and stock adjustments. If we were successful, we could then extend the framework elsewhere on Etsy.com.\"), mdx(\"h3\", {\n    \"id\": \"4-work-in-a-closed-prototype\"\n  }, \"4. Work in a closed prototype\"), mdx(\"p\", null, \"Since this would be an uncharacteristically long project, we would invite 50 sellers to a closed prototype to give us continual feedback. This would grow to thousands as we neared launch later that year.\"), mdx(\"p\", null, \"We began with a tool for managing listings, taking an approach that more closely resembled the grid layout of a seller's actual shop.\"), mdx(ArticleMedia, {\n    caption: \"An early wireframe for the new listings manager\",\n    mdxType: \"ArticleMedia\"\n  }, mdx(Image, {\n    src: \"images/work/etsy/new-listings-wireframe.png\",\n    alt: \"An early wireframe for the new listings manager\",\n    className: \"has-shadow\",\n    mdxType: \"Image\"\n  })), mdx(\"p\", null, \"I always begin projects by quickly iterating with black and white wireframes. This let us share work in person and on Basecamp to generate new ideas and validate existing ones. We also shared work at this stage with sellers by creating functional prototypes connected to their real listings.\"), mdx(ArticleMedia, {\n    caption: \"Editing listings in a panel rather than a separate page\",\n    mdxType: \"ArticleMedia\"\n  }, mdx(Image, {\n    src: \"images/work/etsy/new-listings-edit-wireframe.png\",\n    alt: \"A wireframe for editing a listing in the new listings manager\",\n    className: \"has-shadow\",\n    mdxType: \"Image\"\n  })), mdx(\"p\", null, \"Prototypes helped us understand how sellers wanted to manage their listings. We removed a layout option, made the most common filters more prominent, and simplified navigation.\"), mdx(ArticleMedia, {\n    caption: \"Making adjustments after transitioning from wireframes\",\n    mdxType: \"ArticleMedia\"\n  }, mdx(Image, {\n    src: \"images/work/etsy/new-listings.jpg\",\n    alt: \"A mockup of the new listings manager\",\n    className: \"has-shadow\",\n    mdxType: \"Image\"\n  })), mdx(\"p\", null, \"Over time, we integrated previously separate features like organizing inventory into sections. We also added new functionality like inline editing, listing analytics, and additional bulk editing tools.\"), mdx(ArticleMedia, {\n    caption: \"Adding listing analytics to the listings manager's list view\",\n    mdxType: \"ArticleMedia\"\n  }, mdx(Image, {\n    src: \"images/work/etsy/new-listings-stats.jpg\",\n    alt: \"A mockup of the new listings manager with analytics\",\n    className: \"has-shadow\",\n    mdxType: \"Image\"\n  })), mdx(\"h2\", {\n    \"id\": \"a-living-style-guide\"\n  }, \"A living style guide\"), mdx(\"p\", null, \"While working on the redesign, I was joined by \", mdx(\"a\", _extends({\n    parentName: \"p\"\n  }, {\n    \"href\": \"http://twitter.com/broccolini\"\n  }), \"Diana Mounter\"), \", \", mdx(\"a\", _extends({\n    parentName: \"p\"\n  }, {\n    \"href\": \"http://twitter.com/harllee\"\n  }), \"Jessica Harllee\"), \", and \", mdx(\"a\", _extends({\n    parentName: \"p\"\n  }, {\n    \"href\": \"http://twitter.com/dennispkramer\"\n  }), \"Dennis Kramer\"), \". As I completed work on the listings manager, they began work on order fulfillment, creating a new item listing (which Jessica wrote about \", mdx(\"a\", _extends({\n    parentName: \"p\"\n  }, {\n    \"href\": \"http://jessicaharllee.com/work/etsy-listings-manager\"\n  }), \"here\"), \"), and shop statistics. With each of us working on separate parts of a cohesive suite, it became important to make styles flexible, reusable, and well documented.\"), mdx(\"p\", null, \"Etsy's previous web-based style guide was incomplete and outdated. I had been maintaining a Sketch file with our components, but this was impossible to enforce when implementing work.\"), mdx(ArticleMedia, {\n    caption: \"Etsy.com's components in Sketch\",\n    mdxType: \"ArticleMedia\"\n  }, mdx(Image, {\n    src: \"images/work/etsy/sketch-style-guide.jpg\",\n    alt: \"A screenshot of Etsy.com's design components in Sketch\",\n    mdxType: \"Image\"\n  })), mdx(\"p\", null, \"We solved this problem by creating a style guide using the framework we had built with the new listings manager. I began by thoroughly documenting each of our components. Diana, Jessica, and Dennis contributed by proposing a strict object-oriented CSS approach, creating lessons, and filling in missing components.\"), mdx(ArticleMedia, {\n    caption: \"Grid system documentation in the new style guide\",\n    mdxType: \"ArticleMedia\"\n  }, mdx(Image, {\n    src: \"images/work/etsy/style-guide.png\",\n    alt: \"A screenshot of Etsy's new style guide\",\n    className: \"has-shadow\",\n    mdxType: \"Image\"\n  })), mdx(\"p\", null, \"Our new styles were built with Sass, letting us quickly iterate with variables and stay organized with partials. I advocated for Sass's use throughout the company, eventually helping convert the Etsy's codebase to use it, and led a number of presentations on using it responsibly.\"), mdx(\"p\", null, \"Because the style guide was made up of hundreds of component and utility classes, it helped us create new pages without writing a single line of CSS. This was especially useful for prototyping, and product designers elsewhere in the company began asking when they could use it.\"), mdx(\"p\", null, \"Diana, Jessica, Dennis, and I led sessions on our philosophy on object-oriented CSS, collaboration through pull requests, and demonstrations. This put other product designers in a position to contribute, eventually making the style guide available throughout Etsy.com. To ensure consistency at this scale, I helped organize a style guide group that met regularly to discuss everything from our use of webfonts to how we could iterate on listing card treatments.\"), mdx(\"h2\", {\n    \"id\": \"thanks\"\n  }, \"Thanks\"), mdx(\"p\", null, \"I grew more at Etsy than any other time in my career. From learning how to contribute to a large codebase to developing a philosophy on collaborative product development, I left as a more valuable team member.\"), mdx(\"p\", null, \"It's impossible to mention everyone, but I'd like to thank \", mdx(\"a\", _extends({\n    parentName: \"p\"\n  }, {\n    \"href\": \"http://twitter.com/cap\"\n  }), \"Cap Watkins\"), \", \", mdx(\"a\", _extends({\n    parentName: \"p\"\n  }, {\n    \"href\": \"http://twitter.com/russpos\"\n  }), \"Russ Posluszny\"), \", \", mdx(\"a\", _extends({\n    parentName: \"p\"\n  }, {\n    \"href\": \"http://twitter.com/NickeySkarstad\"\n  }), \"Nickey Skarstad\"), \", \", mdx(\"a\", _extends({\n    parentName: \"p\"\n  }, {\n    \"href\": \"http://twitter.com/kimbost\"\n  }), \"Kim Bost\"), \", \", mdx(\"a\", _extends({\n    parentName: \"p\"\n  }, {\n    \"href\": \"http://twitter.com/jsnhff\"\n  }), \"Jason Huff\"), \", and \", mdx(\"a\", _extends({\n    parentName: \"p\"\n  }, {\n    \"href\": \"http://twitter.com/randyjhunt\"\n  }), \"Randy Hunt\"), \" along with the designers and engineers on the Shop Management team for helping make my two years at Etsy great.\"));\n}\n;\nMDXContent.isMDXComponent = true;","headings":[{"depth":2,"value":"Seller Onboarding"},{"depth":2,"value":"Product announcements"},{"depth":2,"value":"Introducing manufacturing"},{"depth":2,"value":"Better tools for sellers"},{"depth":3,"value":"Shipping profiles"},{"depth":3,"value":"1. Think of pages as workflows rather than features"},{"depth":3,"value":"2. Design for every screen size"},{"depth":3,"value":"3. Save sellers' time with faster tools"},{"depth":3,"value":"4. Work in a closed prototype"},{"depth":2,"value":"A living style guide"},{"depth":2,"value":"Thanks"}],"frontmatter":{"title":"Etsy","tagline":"People power.","dek":"You know Etsy. I led design on an effort to make seller tools more cohesive while introducing a company-wide component-based design system.","dateStart":"2013","dateEnd":"2015","roles":["Staff product designer"],"class":"etsy","invertLine":true,"keyImage":"images/work_key/etsy.png"}}},"pageContext":{"slug":"/work/etsy"}},"staticQueryHashes":["3808394817","547143765","547143765","713810148","713810148"]}