{"componentChunkName":"component---src-templates-work-js","path":"/work/vice","result":{"data":{"mdx":{"body":"function _extends() { _extends = Object.assign || function (target) { for (var i = 1; i < arguments.length; i++) { var source = arguments[i]; for (var key in source) { if (Object.prototype.hasOwnProperty.call(source, key)) { target[key] = source[key]; } } } return target; }; return _extends.apply(this, arguments); }\n\nfunction _objectWithoutProperties(source, excluded) { if (source == null) return {}; var target = _objectWithoutPropertiesLoose(source, excluded); var key, i; if (Object.getOwnPropertySymbols) { var sourceSymbolKeys = Object.getOwnPropertySymbols(source); for (i = 0; i < sourceSymbolKeys.length; i++) { key = sourceSymbolKeys[i]; if (excluded.indexOf(key) >= 0) continue; if (!Object.prototype.propertyIsEnumerable.call(source, key)) continue; target[key] = source[key]; } } return target; }\n\nfunction _objectWithoutPropertiesLoose(source, excluded) { if (source == null) return {}; var target = {}; var sourceKeys = Object.keys(source); var key, i; for (i = 0; i < sourceKeys.length; i++) { key = sourceKeys[i]; if (excluded.indexOf(key) >= 0) continue; target[key] = source[key]; } return target; }\n\n/* @jsxRuntime classic */\n\n/* @jsx mdx */\nvar _frontmatter = {\n  \"title\": \"VICE\",\n  \"tagline\": \"Small team. Big network.\",\n  \"dek\": \"I spent my time at VICE leading design on their homegrown editorial platform, an owned and operated video platform, a suite of native apps, and even a digital rebrand. Itâ€™s a long case study.\",\n  \"dateStart\": \"2016\",\n  \"dateEnd\": \"2020\",\n  \"roles\": [\"Director of product design\", \"Lead product designer\"],\n  \"className\": \"vice\",\n  \"invertLine\": true,\n  \"keyImage\": \"images/work_key/vice.png\",\n  \"cardImage\": \"images/work_cards/vice.jpg\",\n  \"cardImagePosition\": \"40% 0\",\n  \"key\": 1\n};\n\nvar makeShortcode = function makeShortcode(name) {\n  return function MDXDefaultShortcode(props) {\n    console.warn(\"Component \" + name + \" was not imported, exported, or provided by MDXProvider as global scope\");\n    return mdx(\"div\", props);\n  };\n};\n\nvar Link = makeShortcode(\"Link\");\nvar ArticleMedia = makeShortcode(\"ArticleMedia\");\nvar Image = makeShortcode(\"Image\");\nvar Grid = makeShortcode(\"Grid\");\nvar layoutProps = {\n  _frontmatter: _frontmatter\n};\nvar MDXLayout = \"wrapper\";\nreturn function MDXContent(_ref) {\n  var components = _ref.components,\n      props = _objectWithoutProperties(_ref, [\"components\"]);\n\n  return mdx(MDXLayout, _extends({}, layoutProps, props, {\n    components: components,\n    mdxType: \"MDXLayout\"\n  }), mdx(\"p\", null, \"After leaving my second tech startup in 2016, I was struggling to find motivation for my next design role. Trump\\u2019s inexplicable, troll-led rise wrecked any sense of normalcy. Some of us with cushy design jobs were volunteering after hours to protest \\u2013 an admission that selling tech products wasn\\u2019t going to help get us out of this mess.\"), mdx(\"p\", null, \"Meanwhile, the journalists doing actual work to hold America\\u2019s richest assholes accountable were losing their jobs \\u2013 either because of Facebook\\u2019s grip on ad revenue or leather-skinned action figures shutting down good websites. Those who weren\\u2019t losing their jobs were being physically threatened thanks to Trump\\u2019s constant antagonizing.\"), mdx(\"p\", null, \"I\\u2019ve written about \", mdx(Link, {\n    to: \"/blog/why-i-care-about-digital-media\",\n    mdxType: \"Link\"\n  }, \"why I joined VICE\"), \", so I won\\u2019t rehash it here. In short, I was eager to join a company where my work would take a backseat to the important reporting readers visited for.\"), mdx(\"h2\", {\n    \"id\": \"a-unified-network\"\n  }, \"A Unified Network\"), mdx(\"p\", null, \"Even if you're not a fan, you've probably read a VICE article, watched an episode of their HBO show, or channel surfed past their cable channel. What most people don't know about is VICE's extensive network of verticals. Motherboard, Noisey, Munchies, and others all have distinct teams, topics, and readers.\"), mdx(ArticleMedia, {\n    caption: \"VICE's network of verticals\",\n    mdxType: \"ArticleMedia\"\n  }, mdx(Image, {\n    src: \"images/work/vice/network-logos.png\",\n    alt: \"VICE's network of verticals in 2016\",\n    className: \"has-shadow\",\n    mdxType: \"Image\"\n  })), mdx(\"p\", null, \"In 2016, most of our verticals also had unique websites \\u2013 each with isolated templates running on their own CMS. VICE had a deep taxonomy surfaced in its dense navigation. Munchies had its own easy-to-use video directory. Broadly had a unique homepage that highlighted its regular writers.\"), mdx(ArticleMedia, {\n    caption: \"VICE and Noisey's homepages in 2015\",\n    mdxType: \"ArticleMedia\"\n  }, mdx(Grid, {\n    tight: true,\n    mdxType: \"Grid\"\n  }, mdx(Image, {\n    src: \"images/work/vice/old-vice.png\",\n    alt: \"VICE's homepage in 2015\",\n    className: \"has-shadow\",\n    mdxType: \"Image\"\n  }), mdx(Image, {\n    src: \"images/work/vice/old-noisey.png\",\n    alt: \"Noisey's homepage in 2015\",\n    className: \"has-shadow\",\n    mdxType: \"Image\"\n  }))), mdx(\"p\", null, \"Because each site shared little-to-no code, introducing a new feature for one meant others wouldn't see the benefit. This slowed development to a crawl. Sites would go months without updates and we found ourselves re-engineering work already finished elsewhere. When we did launch an update to one of the sites, we couldn't test the new feature between our unique audiences site-to-site. Worst of all, those audiences were so unique because we struggled to recirculate them around the network \\u2013 even when VICE would publish a music article that Noisey fans would love.\"), mdx(\"p\", null, \"Compare our ecosystem to Gizmodo's, Vox's, or New York Magazine's. They've each developed platforms that power each of their network's sites. Gizmodo's sites mostly mirror each other while New York Magazine's offer more unique branding, but because they all share templates they can grow and iterate more quickly.\"), mdx(\"p\", null, \"Some of our sites like VICE and Noisey were feeling dated, but others like Broadly and i-D were still usable and beautiful. Still, we knew it was important for the health of our network to move each site to a single set of templates.\"), mdx(ArticleMedia, {\n    caption: \"i-D and Broadly's homepages in early 2016\",\n    mdxType: \"ArticleMedia\"\n  }, mdx(Grid, {\n    tight: true,\n    mdxType: \"Grid\"\n  }, mdx(Image, {\n    src: \"images/work/vice/old-i-d.png\",\n    alt: \"i-D's homepage in 2016\",\n    className: \"has-shadow\",\n    mdxType: \"Image\"\n  }), mdx(Image, {\n    src: \"images/work/vice/old-broadly.png\",\n    alt: \"Broadly's homepage in 2016\",\n    className: \"has-shadow\",\n    mdxType: \"Image\"\n  }))), mdx(\"p\", null, \"I joined VICE as the team was preparing to launch Uniform \\u2013 our version of a single platform for all of our verticals. Uniform was made up of a series of shared page templates, all powered by a single, shared CMS called Backstage.\"), mdx(\"p\", null, \"Years of content spread across each vertical's distinct sites would be migrated to Uniform, so the team decided to migrate one at a time. Staggering launches meant we could work directly with each editorial team to introduce them to our new CMS, gather required assets, and plan content for launch day. It also meant verticals like The Creators Project and Thump could even rebrand with new names, logos, and typography during with their migration.\"), mdx(\"p\", null, \"The first launch would be Noisey, VICE's decade-old music vertical.\"), mdx(ArticleMedia, {\n    caption: \"Noisey's homepage\",\n    mdxType: \"ArticleMedia\"\n  }, mdx(Image, {\n    src: \"images/work/vice/uniform-homepage-noisey.png\",\n    alt: \"Noisey's homepage\",\n    className: \"has-shadow\",\n    mdxType: \"Image\"\n  })), mdx(\"p\", null, \"After Noisey's launch, I worked with the rest of the design team to further refine Uniform's templates as we launched two new verticals \\u2013 Waypoint in October and Tonic in November.\"), mdx(ArticleMedia, {\n    caption: \"Tonic and Waypoint's homepages\",\n    mdxType: \"ArticleMedia\"\n  }, mdx(Grid, {\n    tight: true,\n    mdxType: \"Grid\"\n  }, mdx(Image, {\n    src: \"images/work/vice/uniform-homepage-tonic.png\",\n    alt: \"Tonic's homepage\",\n    className: \"has-shadow\",\n    mdxType: \"Image\"\n  }), mdx(Image, {\n    src: \"images/work/vice/uniform-homepage-waypoint.png\",\n    alt: \"Waypoint's homepage\",\n    className: \"has-shadow\",\n    mdxType: \"Image\"\n  }))), mdx(\"p\", null, \"With those three site launches behind us, we were comfortable launching VICE just days before Christmas 2016.\"), mdx(ArticleMedia, {\n    caption: \"An article on VICE\",\n    mdxType: \"ArticleMedia\"\n  }, mdx(Image, {\n    src: \"images/work/vice/uniform-article-vice.png\",\n    alt: \"VICE's article page\",\n    className: \"has-shadow\",\n    mdxType: \"Image\"\n  })), mdx(\"p\", null, \"Along with their homepages, each site had shortform and longform article pages, topic pages, and search.\"), mdx(\"p\", null, \"Since we were rushing to migrate one vertical to Uniform each month, we had little time to build a proper component library. This meant that along with each launch came dozens of screens mocked up in Sketch. Each site shared functional templates, but individual styles were inefficiently written component by component.\"), mdx(\"p\", null, \"To save time, we re-factored components to ingest what we called type sheets. Each site would have its own type sheet that contained heading and body declarations. These declarations mirrored each other optically, but allowed for variation in font family, size, and weight. Rewriting components to ingest type sheets meant we could launch a new site with minimal design work.\"), mdx(ArticleMedia, {\n    caption: \"Type sheets for some of VICE's verticals\",\n    mdxType: \"ArticleMedia\"\n  }, mdx(Image, {\n    src: \"images/work/vice/uniform-type-sheets.png\",\n    alt: \"Type sheets\",\n    className: \"has-shadow\",\n    mdxType: \"Image\"\n  })), mdx(\"p\", null, \"We launched the 14th Uniform site \\u2013 Garage \\u2013 in October 2017. With the network's writers all publishing their work to the same platform, we were able to start doing what we'd never been able to before \\u2013 iterate.\"), mdx(\"p\", null, \"We tested new ways to highlight related content on our article pages.\"), mdx(ArticleMedia, {\n    caption: \"One of several ribbon designs on a Motherboard article page\",\n    mdxType: \"ArticleMedia\"\n  }, mdx(Image, {\n    src: \"images/work/vice/uniform-ribbon.png\",\n    alt: \"Article recirculation ribbon\",\n    className: \"has-shadow\",\n    mdxType: \"Image\"\n  })), mdx(\"p\", null, \"We tested alternative homepage layouts for verticals publishing a lot of videos, alongside a more prominent newsletter callout.\"), mdx(ArticleMedia, {\n    caption: \"Broadly's updated homepage\",\n    mdxType: \"ArticleMedia\"\n  }, mdx(Image, {\n    src: \"images/work/vice/uniform-latest-update.png\",\n    alt: \"Broadly's updated homepage\",\n    className: \"has-shadow\",\n    mdxType: \"Image\"\n  })), mdx(\"p\", null, \"We introduced the concept of a series \\u2013 a way to package articles and videos together with different templates.\"), mdx(ArticleMedia, {\n    caption: \"Humans of the Year, a series on Motherboard\",\n    mdxType: \"ArticleMedia\"\n  }, mdx(Image, {\n    src: \"images/work/vice/uniform-themed-series.png\",\n    alt: \"Humans of the Year, a series on Motherboard\",\n    className: \"has-shadow\",\n    mdxType: \"Image\"\n  })), mdx(\"h2\", {\n    \"id\": \"video\"\n  }, \"Video\"), mdx(\"p\", null, \"Many of our fans only tune into VICE's video content. Between digital-only videos, two HBO shows, and our own cable channel, there is fresh content to watch every day.\"), mdx(\"p\", null, \"While most of our views come from YouTube, we also maintain our own video directory and player. Building our own player gave us more than control over its design \\u2013 it allowed us to highlight our unique metadata, tune recommendations, and serve our own ads.\"), mdx(ArticleMedia, {\n    caption: \"VICE's custom, embeddable video player\",\n    mdxType: \"ArticleMedia\"\n  }, mdx(Grid, {\n    tight: true,\n    mdxType: \"Grid\"\n  }, mdx(Image, {\n    src: \"images/work/vice/video-player-1.png\",\n    alt: \"Basic video player controls\",\n    className: \"has-shadow\",\n    mdxType: \"Image\"\n  }), mdx(Image, {\n    src: \"images/work/vice/video-player-2.png\",\n    alt: \"Show details in the video player\",\n    className: \"has-shadow\",\n    mdxType: \"Image\"\n  }))), mdx(\"p\", null, \"The player could be embedded anywhere, but was most commonly used by editors in the body of their articles. To make the player feel native to each vertical, we used typography already defined in our type sheets. This meant the pre-playing \\\"cover\\\" for each video from i-D would look distinct from Broadly's.\"), mdx(ArticleMedia, {\n    caption: \"Vertical branding on VICE's video player\",\n    mdxType: \"ArticleMedia\"\n  }, mdx(Grid, {\n    tight: true,\n    mdxType: \"Grid\"\n  }, mdx(Image, {\n    src: \"images/work/vice/video-player-3.png\",\n    alt: \"Branded video player\",\n    className: \"has-shadow\",\n    mdxType: \"Image\"\n  }), mdx(Image, {\n    src: \"images/work/vice/video-player-4.png\",\n    alt: \"Branded video player\",\n    className: \"has-shadow\",\n    mdxType: \"Image\"\n  }))), mdx(\"p\", null, \"VICE Video was the home for each of our vertical's video content. I inherited the basic site structure and eventually transformed it into a destination that felt more like VICE's homepage \\u2013 allowing our fans to more naturally move between our editorial and video sites.\"), mdx(ArticleMedia, {\n    caption: \"VICE Video's homepage\",\n    mdxType: \"ArticleMedia\"\n  }, mdx(Image, {\n    src: \"images/work/vice/video-homepage.png\",\n    alt: \"VICE Video's homepage\",\n    className: \"has-shadow\",\n    mdxType: \"Image\"\n  })), mdx(ArticleMedia, {\n    caption: \"Watch and show pages on VICE Video\",\n    mdxType: \"ArticleMedia\"\n  }, mdx(Grid, {\n    tight: true,\n    mdxType: \"Grid\"\n  }, mdx(Image, {\n    src: \"images/work/vice/video-watch.png\",\n    alt: \"A video page on VICE Video\",\n    className: \"has-shadow\",\n    mdxType: \"Image\"\n  }), mdx(Image, {\n    src: \"images/work/vice/video-show.png\",\n    alt: \"A show page on VICE Video\",\n    className: \"has-shadow\",\n    mdxType: \"Image\"\n  }))), mdx(\"h2\", {\n    \"id\": \"native-apps\"\n  }, \"Native Apps\"), mdx(ArticleMedia, {\n    caption: \"The landing screen on VICE's iOS app\",\n    \"float\": \"true\",\n    mdxType: \"ArticleMedia\"\n  }, mdx(Image, {\n    src: \"images/work/vice/ios-landing.png\",\n    alt: \"The landing screen on VICE's iOS app\",\n    className: \"has-shadow\",\n    mdxType: \"Image\"\n  })), mdx(\"p\", null, \"Our team also designed and maintained VICE's native apps. The flagship app aggregated articles and videos from around the network (spoiler alert: a precursor to our 2019 web relaunch). VICE News and VICELAND also had their own apps \\u2013 all available on iPhone, iPad, and Android devices.\"), mdx(\"p\", null, \"Since our team was small, both iOS and Android apps shared a device-agnostic aesthetic that allowed for a single set of designs to be applied to both platforms. Some interactions needed to inherit native controls, like sharing articles and video playback, but the two apps were largely identical. As an Android user, this was a tough decision. It meant neither app \", mdx(\"em\", null, \"truly\"), \" felt native to its respective device, but it was a necessary concession to make with our constraints.\"), mdx(\"p\", null, \"I inherited a set of designs created in 2016, before VICE's shift to a simpler, Helvetica-only brand that lasted through 2019. Since the apps needed to reflect our new look, I worked with our engineers to create simpler, more consistent components re-used throughout the app.\"), mdx(ArticleMedia, {\n    caption: \"An article and a video on VICE's iOS app\",\n    mdxType: \"ArticleMedia\"\n  }, mdx(Grid, {\n    tight: true,\n    mdxType: \"Grid\"\n  }, mdx(Image, {\n    src: \"images/work/vice/ios-article.png\",\n    alt: \"An article on VICE's iOS app\",\n    className: \"has-shadow\",\n    mdxType: \"Image\"\n  }), mdx(Image, {\n    src: \"images/work/vice/ios-video.png\",\n    alt: \"A video on VICE's iOS app\",\n    className: \"has-shadow\",\n    mdxType: \"Image\"\n  }))), mdx(\"p\", null, \"Our tablet apps mostly mirrored the phone apps. We identified some high-use screens on tablet though, like the video player, and created new designs optimized for larger screens.\"), mdx(\"p\", null, \"We also saved time by reusing screens and components for VICELAND's app. Because it was a video-only app with far less content, we adjusted grids and removed unneeded screens.\"), mdx(ArticleMedia, {\n    caption: \"Browsing shows on VICE and VICELAND's iPad apps\",\n    mdxType: \"ArticleMedia\"\n  }, mdx(Grid, {\n    tight: true,\n    mdxType: \"Grid\"\n  }, mdx(Image, {\n    src: \"images/work/vice/tos-vice-shows.png\",\n    alt: \"Shows on VICE's iPad app\",\n    className: \"has-shadow\",\n    mdxType: \"Image\"\n  }), mdx(Image, {\n    src: \"images/work/vice/tos-viceland-shows.png\",\n    alt: \"Shows on VICELAND's iPad app\",\n    className: \"has-shadow\",\n    mdxType: \"Image\"\n  }))), mdx(\"h2\", {\n    \"id\": \"vice-news\"\n  }, \"VICE News\"), mdx(\"p\", null, \"VICE News Tonight on HBO premiered in 2016. The show had its own team and aesthetic, so we worked with our friends at \", mdx(\"a\", _extends({\n    parentName: \"p\"\n  }, {\n    \"href\": \"https://postlight.com/\"\n  }), \"Postlight\"), \" to develop a new website that reflected the show.\"), mdx(\"p\", null, \"I loved each of our verticals, but given my reasons for joining the company, VICE News was special. It was a reputable source for timely, straightforward reporting in the vein of The New York Times, but our newsroom wasn't afraid to express a point of view. Their critical coverage of gun violence, the environment, reproductive rights, and politics was world-class.\"), mdx(\"p\", null, \"That's why I was thrilled to inherit design on the VICE News website in 2018.\"), mdx(ArticleMedia, {\n    caption: \"The original VICE News homepage designed by Postlight\",\n    mdxType: \"ArticleMedia\"\n  }, mdx(Image, {\n    src: \"images/work/vice/news-homepage.png\",\n    alt: \"VICE News's homepage\",\n    className: \"has-shadow\",\n    mdxType: \"Image\"\n  })), mdx(\"p\", null, \"The homepage was a simple, linear feed of articles. Articles could be shown as a row or with a custom \\\"cover\\\" design.\"), mdx(\"p\", null, \"My role was brief, but I helped implement long-overdue features like search, simple homepage curation, and a higher fidelity menu that better advertised the HBO show.\"), mdx(ArticleMedia, {\n    caption: \"Search results on VICE News\",\n    mdxType: \"ArticleMedia\"\n  }, mdx(Image, {\n    src: \"images/work/vice/news-search.png\",\n    alt: \"Search on VICE News\",\n    className: \"has-shadow\",\n    mdxType: \"Image\"\n  })), mdx(ArticleMedia, {\n    caption: \"A sponsored collection placed in the homepage feed\",\n    mdxType: \"ArticleMedia\"\n  }, mdx(Image, {\n    src: \"images/work/vice/news-collection.png\",\n    alt: \"A collection on VICE News's homepage\",\n    className: \"has-shadow\",\n    mdxType: \"Image\"\n  })), mdx(\"h2\", {\n    \"id\": \"2019-relaunch\"\n  }, \"2019 Relaunch\"), mdx(\"p\", null, \"Uniform sped up development and made it easy to maintain and launch new verticals. To help drive traffic from one vertical to another, we introduced \\\"linkouts\\\" \\u2013 a way to curate an article from another vertical onto a homepage. This meant when Tonic covered a food story, Munchies could feature it.\"), mdx(ArticleMedia, {\n    caption: \"Motherboard and Tonic linkouts on the Munchies homepage\",\n    mdxType: \"ArticleMedia\"\n  }, mdx(Image, {\n    src: \"images/work/vice/uniform-linkouts.png\",\n    alt: \"Linkouts on the Munchies homepage\",\n    className: \"has-shadow\",\n    mdxType: \"Image\"\n  })), mdx(\"p\", null, \"This helped fans of each vertical move around the network more easily, but curating linkouts was a manual, time consuming process.\"), mdx(\"p\", null, \"Linkouts were also limited to homepages. Noisey was our music vertical and Munchies was our food vertical, but other verticals were covering music and food. Because stories were scoped to a vertical's site, there was nowhere to browse all music or food stories from around the network, regardless of their origin.\"), mdx(\"p\", null, \"Readers weren't moving site-to-site to find articles they were interested in.\"), mdx(\"h3\", {\n    \"id\": \"starting-with-an-experiment\"\n  }, \"Starting with an experiment\"), mdx(\"p\", null, \"VICE has a dedicated insights team, and product design would occasionally perform our own user research as well. While talking to readers as our network grew, we some common statements:\"), mdx(\"ol\", null, mdx(\"li\", {\n    parentName: \"ol\"\n  }, \"Readers didn't recognize VICE's verticals.\"), mdx(\"li\", {\n    parentName: \"ol\"\n  }, \"When readers saw a vertical they didn't recognize, we weren't explaining what the vertical covered. While VICE Sports was branded in an obvious way, it wasn't clear that Tonic covered health and wellness.\"), mdx(\"li\", {\n    parentName: \"ol\"\n  }, \"Fewer people are visiting individual sites in favor of aggregators like Google News, Apple News, and Reddit.\")), mdx(ArticleMedia, {\n    caption: \"Early mockups for a potential Music section on VICE\",\n    mdxType: \"ArticleMedia\"\n  }, mdx(Image, {\n    src: \"images/work/vice/relaunch-section-exploration.png\",\n    alt: \"Early mockups for a potential music section on VICE\",\n    className: \"has-shadow\",\n    mdxType: \"Image\"\n  })), mdx(\"p\", null, \"We started the project with low-fidelity InVision prototypes to explore what a single destination for all of the network's content might look like. Rather than having disconnected, uniquely branded sites, we would treat each vertical as a section on VICE. In essence, sections would be enhanced topic pages with simple navigation and content curation.\"), mdx(\"p\", null, \"Section pages were relatively straightforward. They'd effectively mirror already-existing verticals. Waypoint would become VICE's games section. FREE would become VICE's money section. Areas that VICE already covered, like Entertainment or Drugs, would become sections as well. We thought of them like super topic pages.\"), mdx(\"p\", null, \"On the other hand, a new homepage was more complicated. It suddenly had to showcase a much broader spectrum of content. Each of our verticals published anywhere from 2\\u201312 articles each day. Now that each vertical was losing its own homepage and being represented as a section on VICE, how could we represent each of everything the company published on a single homepage?\"), mdx(\"p\", null, \"We started with mobile designs and created more prototypes. Some relied on editor curation to highlight the best articles published that day, while others were inspired by the personalized aggregators our readers were already familiar with.\"), mdx(ArticleMedia, {\n    caption: \"One of several low-fidelity, mobile prototypes we shared with readers\",\n    mdxType: \"ArticleMedia\"\n  }, mdx(Image, {\n    src: \"images/work/vice/relaunch-prototype-1.png\",\n    alt: \"One of the VICE relaunch prototypes\",\n    className: \"has-shadow\",\n    mdxType: \"Image\"\n  })), mdx(\"h3\", {\n    \"id\": \"sections\"\n  }, \"Sections\"), mdx(\"p\", null, \"While our homepage test ran, we solidified a layout for section pages. To make each page feel uniquely curated without much overhead, we leaned on already-existing topic tags, which we'd been using to categorize articles for years. Editors would customize their section's sub-navigation by selecting topic tags. The Environment section would highlight topic tags like \\\"climate change\\\" and \\\"policy\\\" while the Entertainment section would highlight \\\"celebrity\\\" and \\\"art.\\\"\"), mdx(ArticleMedia, {\n    caption: \"The tops of VICE's Environment and Entertainment section pages\",\n    mdxType: \"ArticleMedia\"\n  }, mdx(Grid, {\n    tight: true,\n    mdxType: \"Grid\"\n  }, mdx(Image, {\n    src: \"images/work/vice/relaunch-section-environment.png\",\n    alt: \"Environment section page\",\n    className: \"has-shadow\",\n    mdxType: \"Image\"\n  }), mdx(Image, {\n    src: \"images/work/vice/relaunch-section-entertainment.png\",\n    alt: \"Entertainment section page\",\n    className: \"has-shadow\",\n    mdxType: \"Image\"\n  }))), mdx(\"p\", null, \"We then used the selected topic tags to construct the body of the page. For each tag, we surfaced the three most recently published articles. This meant each section page could have its own structure without an editor having to spend time hand-curating articles or components.\"), mdx(ArticleMedia, {\n    caption: \"A section page\",\n    mdxType: \"ArticleMedia\"\n  }, mdx(Image, {\n    src: \"images/work/vice/relaunch-section-news.png\",\n    alt: \"News section page\",\n    className: \"has-shadow\",\n    mdxType: \"Image\"\n  })), mdx(\"p\", null, \"Section page branding was a conversation that lasted throughout the project. If we retained each vertical's name and appearance, would the site feel cohesive?\"), mdx(\"p\", null, \"Finding an answer was tough. We didn't want to abandon the reputation Motherboard had built by breaking stories that larger tech sites couldn't. Waypoint's audience was small, but they were devoted more than any of our other verticals \\u2013 mostly driven by the team's engagement with their community. Broadly had become more than a women's interest site. It was a home for the issues surrounding gender and identify before it became fashionable to talk about it.\"), mdx(\"p\", null, \"And personally, I loved the work each of these verticals published.\"), mdx(ArticleMedia, {\n    caption: \"Section branding alternatives for Munchies\",\n    mdxType: \"ArticleMedia\"\n  }, mdx(Image, {\n    src: \"images/work/vice/relaunch-section-branding-exploration.png\",\n    alt: \"Section branding alternatives for Munchies\",\n    className: \"has-shadow\",\n    mdxType: \"Image\"\n  })), mdx(\"p\", null, \"Each vertical's brand had value to its fans, but typical VICE readers were unfamiliar with most of them. After a lot of tough conversations driven by dozens of visuals, we compromised. Broadly, Tonic, Waypoint, and Free would become VICE's unbranded identity, health, games, and money sections. Only Motherboard, Noisey, and Munchies names and logos would be retained, while the UX would remain consistent between branded and unbranded section pages.\"), mdx(\"p\", null, \"On section pages, we put the words tech, music, and food next to Motherboard, Noisey, and Munchies for the readers who were unfamiliar with them. A small logo would also appear in place of the section name on articles pages.\"), mdx(ArticleMedia, {\n    caption: \"Final section branding on Motherboard's section and article pages\",\n    mdxType: \"ArticleMedia\"\n  }, mdx(Grid, {\n    tight: true,\n    mdxType: \"Grid\"\n  }, mdx(Image, {\n    src: \"images/work/vice/relaunch-section-motherboard.png\",\n    alt: \"Final branding on the Motherboard section page\",\n    className: \"has-shadow\",\n    mdxType: \"Image\"\n  }), mdx(Image, {\n    src: \"images/work/vice/relaunch-article-motherboard.png\",\n    alt: \"Final branding on a Motherboard article\",\n    className: \"has-shadow\",\n    mdxType: \"Image\"\n  }))), mdx(\"p\", null, \"Given how sensitive Broadly's retirement was, I worked with then-editor-in-chief Lindsay Schrupp to create a simple, one-page retrospective highlighting their best work.\"), mdx(ArticleMedia, {\n    caption: \"Broadly's post-relaunch microsite\",\n    mdxType: \"ArticleMedia\"\n  }, mdx(Grid, {\n    tight: true,\n    mdxType: \"Grid\"\n  }, mdx(Image, {\n    src: \"images/work/vice/relaunch-broadly-microsite-1.png\",\n    alt: \"Broadly's post-launch microsite\",\n    className: \"has-shadow\",\n    mdxType: \"Image\"\n  }), mdx(Image, {\n    src: \"images/work/vice/relaunch-broadly-microsite-2.png\",\n    alt: \"Broadly's post-launch microsite\",\n    className: \"has-shadow\",\n    mdxType: \"Image\"\n  }))), mdx(\"h3\", {\n    \"id\": \"back-to-the-homepage\"\n  }, \"Back to the homepage\"), mdx(\"p\", null, \"With our quick timeline and small engineering team, we shelved ideas that relied on personalization or complex layouts. Instead, we created a homepage that relied on a mix of editors' curation and new programatic feeds.\"), mdx(ArticleMedia, {\n    caption: \"VICE's new homepage\",\n    mdxType: \"ArticleMedia\"\n  }, mdx(Image, {\n    src: \"images/work/vice/relaunch-homepage.png\",\n    alt: \"VICE's new homepage\",\n    className: \"has-shadow\",\n    mdxType: \"Image\"\n  })), mdx(\"p\", null, \"The page featured a variety of flexible slots that gave our editors control over where to curate articles and videos. We surfaced new popular endpoints for both articles and videos. And at the bottom of the page, we highlighted our new sections with a grid promoting each of their lede stories.\"), mdx(\"h3\", {\n    \"id\": \"evolving-the-vice-brand\"\n  }, \"Evolving the VICE brand\"), mdx(\"p\", null, \"Our switch to Helvetica in 2016 worked nicely in some contexts, but the site could feel plain on more utilitarian pages. Revamping a large portion of the site meant it was a good time to revisit our typography. I proposed replacing Helvetica with a black weight of Neue Haas Grotesk. Since the typefaces shared a history it was an easy sell as a natural evolution of the existing brand, while still having more character than what we had previously.\"), mdx(\"p\", null, \"We chose to leave the UX unchanged for templates like the article page, but our new typography still made them feel dramatically refreshed.\"), mdx(ArticleMedia, {\n    caption: \"VICE's new article page\",\n    mdxType: \"ArticleMedia\"\n  }, mdx(Image, {\n    src: \"images/work/vice/relaunch-article-vice.png\",\n    alt: \"VICE's new article page\",\n    className: \"has-shadow\",\n    mdxType: \"Image\"\n  })), mdx(\"p\", null, \"I also introduced Source Code Pro as an accent font, similar to the monospaced type VICE News was known for.\"), mdx(\"p\", null, \"At this point, our brand designers joined us to refresh our social media accounts. They used our new typography to introduce new Instagram and Snapchat templates that reflected the new site design.\"), mdx(ArticleMedia, {\n    caption: \"New social media templates on Instagram and Snapchat\",\n    mdxType: \"ArticleMedia\"\n  }, mdx(Grid, {\n    tight: true,\n    mdxType: \"Grid\"\n  }, mdx(Image, {\n    src: \"images/work/vice/relaunch-instagram-2.png\",\n    alt: \"Motherboard on Instagram\",\n    className: \"has-shadow\",\n    mdxType: \"Image\"\n  }), mdx(Image, {\n    src: \"images/work/vice/relaunch-snapchat.png\",\n    alt: \"VICE on Snapchat\",\n    className: \"has-shadow\",\n    mdxType: \"Image\"\n  }))), mdx(\"p\", null, \"Now that templates didn't need to be used by a dozen uniquely branded verticals, we refactored type sheets. Font families, weights, and sizes all had CSS classes that could be mixed and matched to give us more design flexibility component to component.\"), mdx(ArticleMedia, {\n    caption: \"VICE's new type sheet\",\n    mdxType: \"ArticleMedia\"\n  }, mdx(Image, {\n    src: \"images/work/vice/relaunch-type-sheet.png\",\n    alt: \"VICE's new type sheet\",\n    className: \"has-shadow\",\n    mdxType: \"Image\"\n  })), mdx(\"p\", null, \"Existing pages were eventually refreshed soon to reflect the new visuals as well. Unlike the old site, we strictly adhered to a small set of components.\"), mdx(ArticleMedia, {\n    caption: \"Updated topic and search results pages\",\n    mdxType: \"ArticleMedia\"\n  }, mdx(Grid, {\n    tight: true,\n    mdxType: \"Grid\"\n  }, mdx(Image, {\n    src: \"images/work/vice/relaunch-topic.png\",\n    alt: \"VICE's updated topic page\",\n    className: \"has-shadow\",\n    mdxType: \"Image\"\n  }), mdx(Image, {\n    src: \"images/work/vice/relaunch-search.png\",\n    alt: \"VICE's updated search page\",\n    className: \"has-shadow\",\n    mdxType: \"Image\"\n  }))), mdx(\"h2\", {\n    \"id\": \"thanks\"\n  }, \"Thanks\"), mdx(\"p\", null, \"Working in digital media has its ups and downs, but I'm thrilled with what we were able to accomplish through it all. From VICE's unification in 2016 to its eventual relaunch in 2019, we set ourselves up for rapid iteration on new features for our expanding newsroom.\"), mdx(\"p\", null, \"I can't wait to see what the team does next.\"));\n}\n;\nMDXContent.isMDXComponent = true;","headings":[{"depth":2,"value":"A Unified Network"},{"depth":2,"value":"Video"},{"depth":2,"value":"Native Apps"},{"depth":2,"value":"VICE News"},{"depth":2,"value":"2019 Relaunch"},{"depth":3,"value":"Starting with an experiment"},{"depth":3,"value":"Sections"},{"depth":3,"value":"Back to the homepage"},{"depth":3,"value":"Evolving the VICE brand"},{"depth":2,"value":"Thanks"}],"frontmatter":{"title":"VICE","tagline":"Small team. Big network.","dek":"I spent my time at VICE leading design on their homegrown editorial platform, an owned and operated video platform, a suite of native apps, and even a digital rebrand. Itâ€™s a long case study.","dateStart":"2016","dateEnd":"2020","roles":["Director of product design","Lead product designer"],"className":"vice","invertLine":true,"keyImage":"images/work_key/vice.png"}}},"pageContext":{"slug":"/work/vice"}},"staticQueryHashes":["3808394817","3808394817","547143765","547143765","713810148","713810148"]}